row_id,sentence1,sentence2,kg1,kg2,aa_kea_similarity
0,But other sources close to the sale said Vivendi was keeping the door open to further bids and hoped to see bidders interested in individual assets team up.,But other sources close to the sale said Vivendi was keeping the door open for further bids in the next day or two.,"[['Vivendi','sale', '_'], ['Vivendi', 'consider', 'further_bids'], ['Vivendi', 'hopes', 'interested_bidders'], ['interested_bidders', 'teamUp', '_']]",[],0.0
1,Micron has declared its first quarterly profit for three years.,Micron's numbers also marked the first quarterly profit in three years for the DRAM manufacturer.,"[['Micron', 'declaredProfit', 'First_quarterly_profit_in_three_years']]","[['Micron', 'firstQuarterlyProfit', 'DRAM_manufacturer']]",0.08333333333333333
2,The fines are part of failed Republican efforts to force or entice the Democrats to return.,"Perry said he backs the Senate's efforts, including the fines, to force the Democrats to return.","[['Republican_efforts', 'type', 'Force_or_entice'], ['Republican_efforts', 'target', 'Democrats'], ['Democrats', 'action', 'Return']]","[['Perry','supports', 'Senate_efforts'], ['Senate_efforts', 'target', 'Democrats'], ['Democrats', 'action','return']]",0.6254627916220946
3,"The American Anglican Council, which represents Episcopalian conservatives, said it will seek authorization to create a separate group.","The American Anglican Council, which represents Episcopalian conservatives, said it will seek authorization to create a separate province in North America because of last week's actions.","[['American_Anglican_Council','represents', 'Episcopalian_conservatives'], ['American_Anglican_Council', 'action','seek_authorization'], ['American_Anglican_Council', 'groupType', 'Separate_group']]","[['American_Anglican_Council','represents', 'Episcopalian_conservatives'], ['American_Anglican_Council', 'action','seek_authorization'], ['American_Anglican_Council', 'goal', 'create_separate_province'], ['American_Anglican_Council', 'location', 'North_America'], ['Episcopalian_conservatives','religious_affiliation', 'Anglican']]",0.5416666666666666
4,"The tech-loaded Nasdaq composite rose 20.96 points to 1595.91, ending at its highest level for 12 months.","The technology-laced Nasdaq Composite Index <.IXIC> climbed 19.11 points, or 1.2 percent, to 1,615.02.","[['Nasdaq_composite', 'changeInPoints', '20.96'], ['Nasdaq_composite', 'currentLevel', '1595.91']]","[['Nasdaq_Composite_Index', 'changeInPoints', '19.11'], ['Nasdaq_Composite_Index', 'changePercentage', '1.2'], ['Nasdaq_Composite_Index', 'value', '1615.02']]",0.3888888888888889
5,"Amgen shares gained 93 cents, or 1.45 percent, to $65.05 in afternoon trading on Nasdaq.",Shares of Allergan were up 14 cents at $78.40 in late trading on the New York Stock Exchange.,"[['Amgen', 'priceChange', '1.45'], ['Amgen', 'price', '65.05'], ['Amgen','stockExchange', 'Nasdaq']]","[['Allergan','stockPrice', '78.4 (dollars)'], ['Allergan', 'location', 'New_York_Stock_Exchange'], ['Allergan','stockPriceChange', '0.14 (dollars)']]",0.0
6,U.S. prosecutors have arrested more than 130 individuals and have seized more than $17 million in a continuing crackdown on Internet fraud and abuse.,More than 130 people have been arrested and $17 million worth of property seized in an Internet fraud sweep announced Friday by three U.S. government agencies.,"[['U.S._prosecutors', 'numberOfArrests', '130'], ['U.S._prosecutors','seizedAssets', '$17_million']]","[['more than 130 people', 'numberOfPeopleArrested', ''],
 ['', 'governmentAgencies', 'Three_US_government_agencies'],
 ['', 'worth', '$17_million'],
 ['', 'propertySeized', ''],
 ['more than 130 people', 'type', 'People'],
 ['', 'agencies', 'U.S._government_agencies']]",0.3888888888888889
7,"Chavez said investigators feel confident they've got ""at least one of the fires resolved in that regard.""","Albuquerque Mayor Martin Chavez said investigators felt confident that with the arrests they had ""at least one of the fires resolved.""","[['Chavez', 'feeling', 'confident'], ['investigators', 'have', 'at least_one_fire_resolved'], ['at_least_one_fire','resolution_status','resolved']]","[['Albuquerque','mayor', 'Martin_Chavez'], ['Albuquerque', 'event', 'arrests'], ['investigators', 'feeling', 'confident'], ['investigators', 'belief', 'at_least_one_fire_resolved']]",0.5353033790313108
8,Authorities said the scientist properly quarantined himself at home after he developed SARS symptoms Dec. 10.,"The scientist also quarantined himself at home as soon as he developed SARS symptoms, officials said.","[['scientist', 'developedSymptoms', 'SARS'], ['scientist', 'quarantined', 'home']]","[['scientist', 'developedSymptoms', 'SARS'], ['scientist', 'quarantined', 'home']]",1.0
9,The support will come as a free software upgrade called WebVPN for current customers that have support contracts.,The upgrade will be available as a free download for current customers with SmarNet support in January 2004.,"[['WebVPN', 'type','software_upgrade'], ['WebVPN', 'availability', 'free'], ['WebVPN', 'for', 'current_customers'], ['current_customers', 'have','support_contracts']]","[['SmarNet','support', 'current_customers'], ['current_customers', 'canDownload', 'upgrade'], ['upgrade', 'availability', 'January_2004'], ['upgrade', 'cost', 'free']]",0.29814239699997197
10,The man accused of using fake grenades to commandeer a Cuban plane that landed in Key West in April was sentenced Friday to 20 years in prison.,A Cuban architect was sentenced to 20 years in prison Friday for using two fake grenades to hijack a passenger plane from Cuba to Florida in April.,"[['Unknown_man', 'crime', 'using_fake_grenades'], ['Unknown_man','sentence', '20_years_in_prison'], ['Key_West', 'location', 'April']]","[['Cuban_architect', 'crime', 'plane_hijacking'], ['plane', 'origin', 'Cuba'], ['plane', 'destination', 'Florida'], ['plane','month', 'April'], ['Cuban_architect','sentence', '20_years']]",0.4
11,"Jim Williams, director of the US-VISIT project, said that by the middle of November, many arriving passengers in Atlanta will be fingerprinted and photographed.","Jim Williams, director of the US-VISIT project, said that by the middle of November, inspectors will be fingerprinting and photographing many foreign passengers arriving in Atlanta.","[['Jim_Williams', 'role', 'director_of_US-VISIT_project'], ['US-VISIT_project', 'process', 'fingerprinting_and_photography'], ['Atlanta', 'location','many_arriving_passengers']]","[['Jim_Williams', 'role', 'director_of_US-VISIT_project'], ['US-VISIT_project', 'activity', 'fingerprinting_and_photographing_foreign_passengers'], ['Jim_Williams', 'location', 'Atlanta']]",0.6085806194501846
12,"The hearing occurred a day after the Pentagon for the first time singled out an officer, Dallager, for not addressing the scandal.",The hearing came one day after the Pentagon for the first time singled out an officer - Dallager - for failing to address the scandal.,"[['Pentagon','singledOut', 'Dallager']]","[['Pentagon','singledOutOfficer', 'Dallager']]",1.0
13,"The Episcopal Church ''is alienating itself from the Anglican Communion,'' said the Very Rev. Peter Karanja, provost of the All Saints Cathedral, in Nairobi.","In Nairobi, the provost of All Saints Cathedral, the Very Reverend Peter Karanja, said the US Episcopal Church was alienating itself from the Anglican Communion.","[['Episcopal_Church', 'action', 'alienate_itself'], ['Anglican_Communion','relationship', 'part_of'], ['Anglican_Communion', 'type', 'Christian_denomination'], ['Episcopal_Church','relationship', 'part_of'], ['Episcopal_Church', 'type', 'Christian_denomination'], ['Very_Rev._Peter_Karanja', 'title', 'provost'], ['Very_Rev._Peter_Karanja', 'affiliation', 'All_Saints_Cathedral'], ['All_Saints_Cathedral', 'location', 'Nairobi']]","[['All_Saints_Cathedral', 'location', 'Nairobi'], ['All_Saints_Cathedral', 'provost', 'The_Very_Reverend_Peter_Karanja'], ['The_Very_Reverend_Peter_Karanja','said', 'US_Episcopal_Church_is_alienating_itself'], ['US_Episcopal_Church', 'from', 'Anglican_Communion']]",0.46770717334674267
14,"Counties with population declines will be Vermillion, Posey and Madison.","Vermillion, Posey and Madison County populations will decline.","[['Vermillion', 'populationChange', 'decline'], ['Posey', 'populationChange', 'decline'], ['Madison', 'populationChange', 'decline']]","[['Vermillion', 'population', 'decline'], ['Posey', 'population', 'decline'], ['Madison_County', 'population', 'decline']]",1.0
15,"Swartz, indicted in February, had argued that New Hampshire was the wrong place to charge him.","Swartz had sought to have the charges dismissed, saying New Hampshire was the wrong place to charge him.","[['Swartz', 'indicted', 'February']]","[['Swartz', 'location', 'New_Hampshire']]
['Swartz', 'wantedAction', 'dismiss_charges']",0.0
16,"The last time the survey was conducted, in 1995, those numbers matched.","In 1995, the last survey, those numbers were equal.",[],[],0.0
17,Higher courts have ruled that the tablets broke the constitutional separation of church and state.,The federal courts have ruled that the monument violates the constitutional ban against state-established religion.,"[['constitutional_separation_of_church_and_state', 'violated', 'higher_courts']]","[['monument', 'violates', 'constitutional_ban'], ['constitutional_ban', 'against','state-established_religion'], ['monument', 'establishedBy','state']]",0.0
18,They were at Raffles Hospital over the weekend for further evaluation.,"They underwent more tests over the weekend, and are now warded at Raffles Hospital.","[['Raffles_Hospital', 'type', 'Hospital'], ['They', 'wereAt', 'Raffles_Hospital'], ['Raffles_Hospital', 'time', 'Weekend']]","[['They', 'are_warded_at', 'Raffles_Hospital']]",0.11785113019775793
19,"When the bomb exploded at the Casa de España, customers were eating dinner and playing bingo.","At the Casa de Espaa, customers were eating dinner and playing bingo when a bomb went off.","[['Casa_de_España', 'event', 'explosion'], ['Casa_de_España', 'customers', 'People'], ['People', 'activity', 'eating_dinner'], ['People', 'activity', 'playing_bingo']]","[['Casa_de_Espana', 'activity', 'dinner_and_bingo'], ['Casa_de_Espana', 'event', 'bomb_explosion']]",0.5594309277855158
20,Plofsky said the commission won't investigate because the three-year statute of limitations has expired.,"The panel will not begin a formal investigation because the statute of limitations has expired, Plofsky said.","[['Plofsky','said', 'commission']]
[['commission', 'won\'t_investigate', None]]
[['commission','statute_of_limitations', '3-years']]","[['Plofsky','said', 'The_panel']]
['The_panel', 'action', 'not_begin_formal_investigation']
['The_panel','reason','statute_of_limitations_expired']",0.0
21,"In two weeks, he'll probably send out Peace Rules in the Preakness.",Frankel said Peace Rules will run in the Preakness Stakes on May 17.,"[['he','sendsOut', 'Peace_Rules'], ['Peace_Rules', 'event', 'Preakness']]","[['Peace_Rules', 'race', 'Preakness_Stakes'], ['Preakness_Stakes', 'date', 'May_17']]",0.816496580927726
22,"If convicted of the spying charges, he could face the death penalty.",The charges of espionage and aiding the enemy can carry the death penalty.,"[['he', 'allegation','spying\_charges'], ['spying\_charges', 'penalty', 'death\_penalty']]","[['espionage', 'carriesPenalty', 'death_penalty'], ['aiding_the_enemy', 'carriesPenalty', 'death_penalty']]",0.408248290463863
23,"The technology-laced Nasdaq Composite Index was up 7.60 points, or 0.46 percent, at 1,653.62.","The broader Standard & Poor's 500 Index <.SPX> shed 2.38 points, or 0.24 percent, at 995.10.","[['Nasdaq_Composite_Index', 'changeInPoints', '7.60'], ['Nasdaq_Composite_Index', 'percentageChange', '0.46'], ['Nasdaq_Composite_Index', 'value', '1,653.62']]","[['Standard\_&\_Poors\_500\_Index','shedPoints', '2.38'], ['Standard\_&\_Poors\_500\_Index', 'percentChange', '-0.24'], ['Standard\_&\_Poors\_500\_Index', 'value', '995.10']]",0.28867513459481287
24,Hilsenrath and Klarman each were indicted on three counts of securities fraud.,Klarman was charged with 16 counts of wire fraud.,"[['Hilsenrath', 'indictedOn', '3 (counts_of_securities_fraud)'], ['Klarman', 'indictedOn', '3 (counts_of_securities_fraud)']]","[['Klarman', 'wasChargedWith', '16 (counts_of_wire_fraud)']]",0.13608276348795434
25,Entrenched interests are positioning themselves to control the network's chokepoints and they are lobbying the FCC to aid and abet them.,"It may be dying because entrenched interests are positioning themselves to control the Internet's choke-points and they are lobbying the FCC to aid and abet them.""","[['Entrenched_interests', 'lobbying', 'FCC'], ['FCC', 'role', 'Regulator']]","[['Internet', 'issue', 'dying'], ['Entrenched_interests', 'action', 'positioning'], ['Entrenched_interests', 'goal', 'control_Internet_chokepoints'], ['FCC', 'role', 'aid_and_abet'], ['FCC', 'entity', 'Government_agency']]",0.09622504486493763
26,But church members and observers say they expect that the decision could be problematic for many Episcopalians.,But church members and observers say they anticipate that the decision here could pose doctrinal problems for some Episcopalians who believe the Bible prohibits homosexuality.,"[['Episcopalians','religion', 'Church_members_and_observers'], ['Episcopalians', 'expectation', 'problematic_decision']]","[['Episcopalians', 'belief', 'Bible_prohibits_homosexuality'], ['some_Episcopalians', 'issue', 'doctrinal_problems']]",0.12909944487358055
27,Squyres is principal investigator for the Athena payload - a collection of science instruments carted by each rover.,"Steve Squyres, a Cornell University scientist, is principal investigator for the missions' science instruments.","[['Squyres', 'role', 'principal_investigator'], ['Squyres', 'payload', 'Athena']]","[['Steve_Squyres', 'affiliation', 'Cornell_University'], ['Steve_Squyres', 'role', 'principal_investigator'], ['Steve_Squyres', 'for','missions'], ['missions','science_instruments', '']]",0.3888888888888889
28,"The military said it had killed 12 rebels and captured nine in the campaign so far, for the loss of six soldiers wounded.","The military said it had killed 16 rebels and captured nine in the campaign so far, with one soldier killed and six wounded.","[['Rebels', 'numberKilled', '12'], ['Soldiers', 'numberWounded', '6'], ['Rebels', 'numberCaptured', '9']]","[['Rebels', 'numberKilled', '16'], ['Rebels', 'captured', '9'], ['Soldiers', 'numberKilled', '1'], ['Soldiers', 'numberWounded', '6']]",0.4844813951249544
29,The new sensor -- dubbed CANARY for ''cellular analysis and notification of antigen risks and yields'' -- hijacks this natural process with two important changes.,"The team has named the sensor Canary, for cellular analysis and notification of antigen risks and yields.","[['CANARY', 'function', 'cellular_analysis_and_notification_of_antigen_risks_and_yields'], ['CANARY', 'dubbedAs', 'cellular_analysis_and_notification_of_antigen_risks_and_yields']]","[['Canary', 'function', 'cellular_analysis'], ['Canary', 'function', 'antigen_risks_notification'], ['Canary', 'type','sensor']]",1.0
30,Express Scripts ESRX.O shares fell 3.6 percent to close at $66.89 on the Nasdaq.,Shares of Express Scripts ESRX.O fell about 4 percent to $66.73 on the Nasdaq in late morning trade.,"[['Express_Scripts_ESRX.O','stockPrice', '66.89'], ['Express_Scripts_ESRX.O','stockExchange', 'Nasdaq'], ['Express_Scripts_ESRX.O', 'percentChange', '-3.6']]","[['Express_Scripts','stockPrice', '66.73'], ['Express_Scripts','stockExchange', 'Nasdaq']]",0.6254627916220946
31,"One, Fort Carson-based Sgt. Ernest Bucklew, 33, had been on his way home to attend his mother's funeral in Pennsylvania.","Sgt. Ernest Bucklew, 33, was coming home from Iraq to bury his mother in Pennsylvania.","[['Sgt. Ernest Bucklew', 'age', '33'], ['Sgt. Ernest Bucklew', 'location', 'Fort Carson'], ['Sgt. Ernest Bucklew', 'destination', 'Pennsylvania']]","[['Sgt.\_Ernest\_Bucklew', 'age', '33'], ['Sgt.\_Ernest\_Bucklew', 'country', 'Iraq'], ['Sgt.\_Ernest\_Bucklew', 'origin', 'Pennsylvania'], ['Pennsylvania', 'country', 'United\_States']]",0.6254627916220946
32,Police launched an international hunt for Shevaun Pennington after she ran away with 31-year-old Toby Studabaker Saturday.,Shevaun Pennington disappeared on Saturday morning after arranging to meet 31-year-old Toby Studabaker.,"[['Shevaun_Pennington', 'ranAwayWith', 'Toby_Studabaker'], ['Toby_Studabaker', 'age', '31'], ['Shevaun_Pennington', 'launchedInvestigation', 'Police']]","[['Shevaun_Pennington', 'disappeared', 'Saturday_morning'], ['Shevaun_Pennington', 'arrangedMeetingWith', 'Toby_Studabaker']]",0.09622504486493763
33,"Lawyers and others familiar with the federal investigation say it remains focused on Campbell, though prosecutors declined to discuss the probe.","While federal prosecutors refuse to discuss the investigation, lawyers and others familiar with it say it remains focused on Campbell.","[['Campbell', 'focusOfInvestigation', 'federal_investigation']]","[['Campbell', 'focusOfInvestigation', 'Federal_prosecutors']]",1.0
34,"The Dow Jones industrial average .DJI was off 58.69 points, or 0.64 percent, at 9,137.86.","The blue-chip Dow Jones industrial average .DJI fell 86.56 points, or 0.94 percent, to 9,109.99, after giving up more than 1 percent earlier.","[['.DJI', 'changeInPoints', '-58.69'], ['Dow_Jones_industrial_average', 'value', '9137.86'], ['Dow_Jones_industrial_average', 'percentChange', '-0.64']]","[['.DJI', 'decreased', '9109.99'], ['.DJI', 'decreaseAmount', '86.56'], ['.DJI', 'percentageDecrease', '0.94']]",0.5984437489312764
35,Peace Rules defeated Funny Cide in the Louisiana Derby.,But neither he nor Peace Rules could keep Funny Cide from drawing away.,"[['Peace_Rules', 'defeated', 'Funny_Cide']]",[],0.0
36,Waksal has pleaded guilty to securities fraud and is to be sentenced next week.,"Waksal pleaded guilty to insider trading charges last year, and he is scheduled to be sentenced June 10.","[['Waksal', 'crime', 'Securities_fraud']]","[['Waksal', 'crime', 'Insider_trading'], ['Waksal','sentenceDate', 'June\_10']]",0.08333333333333333
37,He allowed two runs in seven innings and struck out six.,Zambrano pitched seven innings and allowed two runs on five hits and four walks.,"[['He', 'allowedRuns', '2'], ['He','strikesOut', '6'], ['He', 'inningsPitched', '7']]","[['Zambrano', 'pitched', '7\_innings'], ['Zambrano', 'allowedRuns', '2'], ['Zambrano', 'allowedHits', '5'], ['Zambrano', 'allowedWalks', '4']]",0.28867513459481287
38,"Still, he said, ""I'm absolutely confident we're going to have a bill.""","""I'm absolutely confident we're going to have a bill,"" Frist, R-Tenn., said Thursday.",[],"[['Frist', 'confidence', 'bill']]",0.0
39,Boeing said the final agreement is expected to be signed during the next few weeks.,"The Korean Air deal is expected to be finalized ""in the next several weeks,"" Boeing spokesman Bob Saling said.","[['Boeing', 'expectedAction','sign_agreement']]","[['Boeing','spokesman', 'Bob_Saling'], ['Korean_Air_deal', 'expectedCompletion', 'next_few_weeks'], ['Boeing', 'hasDealWith', 'Korean_Air']]",0.08333333333333333
40,"Shares in EDS closed on Thursday at $18.51, a gain of 6 cents.","Shares of EDS closed Thursday at $18.51, up 6 cents on the New York Stock Exchange.","[['EDS', 'closingPrice', '18.51'], ['EDS', 'priceChange', '0.06']]","[['EDS', 'closingPrice', '18.51'], ['EDS', 'exchange', 'New_York_Stock_Exchange'], ['EDS', 'priceChange', '0.06']]",1.0
41,"Nationally, the federal Centers for Disease Control and Prevention recorded 4,156 cases of West Nile, including 284 deaths.","There were 293 human cases of West Nile in Indiana in 2002, including 11 deaths statewide.","[['CDC','recordedCases', '4156'], ['CDC','recordedDeaths', '284'], ['West_Nile', 'numberOfCases', '4156'], ['West_Nile', 'numberOfDeaths', '284'], ['CDC', 'type', 'Federal_agency']]","[['Indiana', 'humanCasesWestNile', '293'], ['Indiana', 'deaths', '11']]",0.0
42,A divided Supreme Court ruled Monday that Congress can force the nation's public libraries to equip computers with anti-pornography filters.,"The Supreme Court said Monday the government can require public libraries to equip computers with anti-pornography filters, rejecting librarians' complaints that the law amounts to censorship.","[['Supreme_Court', 'ruled', 'Monday'], ['Supreme_Court', 'canForce', 'Congress'], ['Congress', 'canDo', 'equip_nation_public_libraries'], ['nation_public_libraries','mustEquipWith', 'anti-pornography_filters']]","[['Supreme_Court','said', 'Monday'], ['Government', 'canRequire', 'public_libraries'], ['public_libraries', 'toEquip', 'computers'], ['computers', 'with', 'anti-pornography_filters'], ['Supreme_Court','rejected', 'librarians'], ['librarians', 'complaints', 'amountsTo', 'censorship']]",0.5407380704358752
43,The weakness exists in the way that VBA looks at the properties of documents passed to it when the document is opened by a host application.,The vulnerability exists in the way Microsoft's Visual Basic for Applications checks document properties passed to it when a document is opened.,"[['VBA', 'behavior', 'weakness'], ['weakness','regards', 'properties_of_documents'], ['documents', 'action', 'passed_to_VBA_on_opening']]","[['Microsoft', 'product', 'Visual_Basic_for_Applications'], ['Microsoft', 'action', 'checks_document_properties'], ['Visual_Basic_for_Applications','receives', 'document_properties'], ['document_properties', 'issue', 'vulnerability']]",0.06666666666666667
44,"Of 24 million phoned-in votes, 50.28 percent were for Studdard, putting him 130,000 votes ahead of Aiken.","Of the 24 million phone votes cast, Studdard was only 130,000 votes ahead of Aiken.","[['Studdard', 'percentageOfVotes', '50.28'], ['Studdard', 'numberOfVotes', '12064000'], ['Aiken', 'numberOfVotes', '10764000']]","[['Studdard', 'votes', '24000000'], ['Aiken', 'votes', '23870000'], ['Studdard', 'leadOver', 'Aiken'], ['Units', 'type', 'phone_votes']]",0.29814239699997197
45,Consumers still would have to get a descrambling security card from their cable operator to plug into the set.,"To watch pay television, consumers would insert into the set a security card provided by their cable service.","[['Consumers', 'need', 'descrambling_security_card'], ['descrambling_security_card', 'issuer', 'cable_operator']]","[['Consumer', 'action', 'watch_pay_television'], ['Consumer', 'needs','security_card'], ['security_card', 'provider', 'cable_service']]",1.0
46,"However, we have decided to opt for the European consortium's engine as the best overall solution and due to the substantial price efforts made"".","However, we have decided to opt for the European consortium's engine as the best overall solution.""","[['European_consortium','solutionChosen', 'Best_overall_solution'], ['European_consortium', 'priceEfforts', 'Substantial']]",[],0.0
47,"The Food and Drug Administration rejected ImClone's 2001 application to sell Erbitux, citing shoddy research.","The U.S. Food and Drug Administration rejected ImClone's original application in December 2001, saying the trial had been sloppily conducted.","[['ImClone', 'applicationRejectedBy', 'Food\_and\_Drug\_Administration'], ['Food\_and\_Drug\_Administration','reasonForRejection', 'Shoddy\_research'], ['ImClone', 'drug', 'Erbitux']]","[['ImClone', 'applicationRejectedBy', 'U.S._Food\_and\_Drug\_Administration'], ['U.S._Food\_and\_Drug\_Administration','reasonForRejection', 'Sloppily\_conducted\_trial'], ['ImClone', 'applicationMonth', 'December\_2001']]",0.09622504486493763
48,"Critics say the law violates civil liberties, something House Judiciary Committee Chairman James Sensenbrenner, R-Wis., says he is sensitive to.","House Judiciary Committee Chairman James Sensenbrenner, R-Wis., says he is sensitive to civil liberties complaints.","[['James_Sensenbrenner', 'role', 'House_Judiciary_Committee_Chairman'], ['James_Sensenbrenner', 'politicalParty', 'Republican'], ['Critics', 'action', 'violate_civil_liberties']]","[['James_Sensenbrenner', 'profession', 'House_Judiciary_Committee_Chairman'], ['James_Sensenbrenner', 'politicalParty', 'R-Wis.']]",0.30123203803835463
49,"The Dodgers won their sixth consecutive game their longest win streak since 2001 as they edged Colorado, 3-2, Wednesday in front of a crowd of 25,332 at Dodger Stadium.","The Dodgers won their sixth consecutive game and seventh in their last nine as they beat Colorado 3-2 on Wednesday in front of a crowd of 25,332 at Dodger Stadium.","[['Dodgers', 'winStreak', '6'], ['Dodgers', 'wonGame', 'Colorado'], ['Colorado', 'lostGame', 'Dodgers'], ['Dodgers', 'attendance', '25332'], ['Dodgers', 'location', 'Dodger_Stadium']]","[['Dodgers', 'won', '6'], ['Dodgers', 'won', '7'], ['Dodgers', 'beated', 'Colorado'], ['Colorado', 'lost', '3-2'], ['Dodgers', 'numberOfSpectators', '25332'], ['Dodgers', 'location', 'Dodger_Stadium']]",1.0
50,"So far, they have searched Pennsylvania, Ohio, Michigan, Illinois and Indiana, authorities in those state said.","So far, authorities also have searched areas in Pennsylvania, Ohio, Indiana, and Michigan.","[['Pennsylvania','state', '_'], ['Ohio','state', '_'], ['Michigan','state', '_'], ['Illinois','state', '_'], ['Indiana','state', '_'], ['authorities', 'locatedIn', '_']]","[['Pennsylvania', 'location', 'Areas_searched'], ['Ohio', 'location', 'Areas_searched'], ['Indiana', 'location', 'Areas_searched'], ['Michigan', 'location', 'Areas_searched'], ['Authorities', 'action', 'Searched_areas']]",0.47619047619047616
