row_id,sentence1,sentence2,kg1,kg2,aa_kea_similarity
51,"The 30-year bond US30YT=RR firmed 31/32, taking its yield to 4.16 percent -- another record low -- from 4.22 percent.","The 30-year bond <US30YT=RR> firmed 24/32, taking its yield to 4.18 percent, after hitting another record low of 4.16 percent.","[['US30YT=RR', 'yield', '4.16'], ['US30YT=RR', 'previousYield', '4.22']]","[['US30YT=RR', 'yield', '4.18'], ['US30YT=RR','recordLowYield', '4.16']]",1.0
52,"On Thursday, a Washington Post article argued that a 50 basis point cut from the Fed was more likely, contrary to the Wall Street Journal's line.","On Thursday, a Post article argued that a 50 basis point cut from the Fed was more likely.","[['Fed', 'action', '50_basis_point_cut'], ['Washington_Post', 'published', 'Thursday'], ['Wall_Street_Journal', 'position', 'contrary_to_Fed_cut'], ['Fed','moreLikelyAction', '50_basis_point_cut']]","[['Fed', 'action', '50_basis_point_cut'], ['Fed', 'day', 'Thursday']]",0.510688230856951
53,"Mr. Heatley, who suffered a broken jaw and torn knee ligaments, faces several charges.",Heatley underwent surgery Saturday for a broken jaw and an MRI found two torn ligaments in his right knee.,"[['Mr. Heatley', 'injury', ['broken jaw', 'torn knee ligaments']], ['Mr. Heatley', 'facesCharges','several']]","[['Heatley', 'injury', 'broken_jaw'], ['Heatley', 'injury', 'torn_ligaments'], ['Heatley', 'injuryLocation', 'right_knee'], ['Heatley', 'underwent','surgery']]",0.0
54,Lay had argued that handing over the documents would be a violation of his Fifth Amendment rights against self-incrimination.,"Lay had refused to turn over the papers, asserting his Fifth Amendment right against self-incrimination.","[['Lay', 'rightsViolated', 'Fifth_Amendment'], ['Fifth_Amendment', 'right', 'Self-incrimination']]","[['Lay', 'right', 'Fifth_Amendment_right_against_self-incrimination'], ['Lay', 'action','refused_to_turn_over_papers']]",0.5809475019311126
55,Strayhorn said it was the first time in Texas history a comptroller had not certified the appropriations act.,"In a news release Thursday, Strayhorn said this was the first time a comptroller rejected a budget.","[['Strayhorn', 'firstName', 'Strayhorn'], ['Strayhorn', 'role', 'Comptroller'], ['Texas_history', 'event', 'first_time_comptroller_did_not_certify_appropriations_act'], ['Strayhorn', 'action', 'did_not_certify_appropriations_act']]","[['Strayhorn', 'action','rejected_a_budget'], ['Strayhorn', 'type', 'Comptroller']]",0.30123203803835463
56,"Excluding the charges, analysts, on average, expected a loss of 11 cents a share.",Analysts polled by Thomson Financial First Call had been expected to see a loss of about 11 cents a share from continuing operations.,"[['Analysts', 'expectedLossPerShare', '11 (cents)']]","[['Thomson_Financial_First_Call', 'expectedLoss', '11 (cents_per_share)'], ['Analysts', 'expectedLossFrom', 'continuing_operations']]",0.5
57,"Security experts are warning that a new mass-mailing worm is spreading widely across the Internet, sometimes posing as e-mail from the Microsoft founder.","A new worm has been spreading rapidly across the Internet, sometimes pretending to be an e-mail from Microsoft Chairman Bill Gates, antivirus vendors said Monday.","[['Security_experts', 'activity', 'warning'], ['new_mass-mailing_worm', 'type','malware'], ['Internet', 'affectedBy', 'new_mass-mailing_worm'], ['new_mass-mailing_worm','sender', 'Microsoft_founder'], ['Microsoft_founder', 'role', 'Founder']]","[['Microsoft_Chairman_Bill_Gates', 'type', 'Chairman'], ['Microsoft_Chairman_Bill_Gates', 'company', 'Microsoft'], ['new_worm', 'pretendsToBe', 'e-mail_from_Microsoft_Chairman_Bill_Gates'], ['new_worm','spreadsAcross', 'Internet']]",0.2253744679276044
58,Mr Sahel said police had identified the bodies of seven of the 14-strong cell believed to have carried out the five almost simultaneous attacks on Saturday.,He said police had identified the bodies of seven of the 14 bombers who launched five almost simultaneous raids Friday night.,"[['Mr\_Sahel', 'identifiedBodiesOf', ['7','members_of_the_cell']], ['members_of_the_cell', 'numberOfMembers', '14'], ['members_of_the_cell', 'carriedOut', ['5', 'attacks']], ['5', 'type', 'almost_simultaneous_attacks'], ['5', 'occurredOn', 'Saturday']]","[['the_bombers', 'numberOfMembers', '14'], ['the_bombers', 'identifiedBodies', '7']]",0.0
59,"Only New Jersey now bans holders of learners permits or intermediate licenses from using cell phones, pagers or other wireless devices while driving.","In addition, the NTSB also recommended to NHTSA that state legislation be enacted to prohibit holders of learners permits and intermediate licenses from using mobile phones while driving.","[['New_Jersey', 'bans', 'holders_of_learners_permits_or_intermediate_licenses'], ['holders_of_learners_permits_or_intermediate_licenses', 'useProhibited', 'cell_phones'], ['cell_phones', 'type', 'Wireless_devices']]","[['NTSB','recommendationTo', 'NHTSA'], ['NHTSA', 'legislation', 'Prohibit_mobile_phone_use_by_learners_and_intermediate_drivers'], ['Learners_permits_and_intermediate_licenses', 'prohibitedAction', 'Mobile_phone_use_while_driving']]",0.05892556509887897
60,The University of Michigan released today a new admissions policy after the U.S. Supreme Court struck down in June the way it previously admitted undergraduates.,The University of Michigan plans to release a new undergraduate admissions policy Thursday after its acceptance requirements were rejected by the U.S. Supreme Court in June.,"[['University_of_Michigan','released', 'new_admissions_policy'], ['new_admissions_policy', 'type', 'policy'], ['University_of_Michigan', 'previouslyAdmittedUndergraduates', 'old_admissions_way'], ['old_admissions_way','struckDown', 'U.S._Supreme_Court'], ['U.S._Supreme_Court','month', 'June'], ['University_of_Michigan', 'hasType', 'University']]","[['University_of_Michigan', 'newPolicy', 'undergraduate_admissions_policy'], ['undergraduate_admissions_policy','releaseDate', 'Thursday'], ['University_of_Michigan', 'previousPolicy', 'acceptance_requirements'], ['acceptance_requirements','rejectedBy', 'U.S._Supreme_Court'], ['U.S._Supreme_Court', 'decisionDate', 'June']]",0.4615930911724977
61,The audiotape aired last week by the Arab Al-Jazeera television network appears to be an effort to incite attacks.,An audiotape aired last week by the Arab al-Jazeera television network may be the strongest evidence yet that Saddam survived the war.,"[['Arab_Al-Jazeera_television_network', 'broadcast', 'audiotape'], ['audiotape', 'purpose', 'incite_attacks']]","[['Arab_al-Jazeera_television_network', 'broadcast', 'an_audiotape'], ['an_audiotape', 'evidenceFor', 'Saddam_survived_the_war']]",0.2041241452319315
62,Former company chief financial officer Franklyn M. Bergonzi pleaded guilty to one count of conspiracy on June 5 and agreed to cooperate with prosecutors.,"Last week, former chief financial officer Franklyn Bergonzi pleaded guilty to one count of conspiracy and agreed to cooperate with the government's investigation.","[['Franklyn_M._Bergonzi', 'crime', 'Conspiracy'], ['Franklyn_M._Bergonzi', 'pleadedGuilty', 'June_5']]","[['Franklyn_Bergonzi', 'pleadedGuilty', 'one_count_of_conspiracy'], ['Franklyn_Bergonzi', 'agreedToCooperate', 'government']]",0.4762896722078402
63,The company didn't detail the costs of the replacement and repairs.,But company officials expect the costs of the replacement work to run into the millions of dollars.,[[]],"[['company_officials', 'expect','millions_of_dollars']]",0.0
64,"Dean told reporters traveling on his 10-city ""Sleepless Summer"" tour that he considered campaigning in Texas a challenge.","Today, Dean ends his four-day, 10-city ""Sleepless Summer"" tour in Chicago and New York.","[['Dean', 'tour', 'Sleepless_Summer'], ['Sleepless_Summer', 'numberOfCities', '10'], ['Dean', 'location', 'Texas']]","[['Dean', 'city', 'Chicago'], ['Dean', 'city', 'New_York'], ['Chicago', 'type', 'City'], ['New_York', 'type', 'City'], ['Dean', 'tour', 'Sleepless_Summer_tour'], ['Sleepless_Summer_tour', 'duration', '4_days'], ['Sleeversless_Summer_tour', 'numberOfCities', '10']]",0.08333333333333333
65,"""I felt that if I disagreed with Rosie too much I would lose my job,"" she said.","Cavender did say: ""I felt that if I disagreed with Rosie too much I would lose my job.""","[['Rosie','relationship', 'job']]
['she','relationship', 'disagree_with', 'Rosie']
['she','relationship', 'lose_job']","[['Cavender', 'employee', 'Rosie'], ['Cavender', 'fear', 'lose_job']]",0.0
66,The device plays Internet radio streams and comes with a 30-day trial of RealNetworks' Rhapsody music service.,The product also streams Internet radio and comes with a 30-day free trial for RealNetworks' Rhapsody digital music subscription service.,"[['The_device', 'plays', 'Internet_radio_streams'], ['The_device', 'comesWith', ['30-day_trial', 'RealNetworks_Rhapsody_music_service']]]","[['Product','streams', 'Internet_radio'], ['Product', 'includes', 'RealNetworks_Rhapsody'], ['RealNetworks_Rhapsody', 'type', 'Digital_music_subscription_service'], ['Product', 'offers', '30-day_free_trial']]",0.0
67,"The dollar fell as low as $1.1624 per euro from $1.1486 on Friday, and traded at $1.1594 at 10:15 a.m. in London.",The dollar dropped to $1.1564 per euro at 7:30 a.m. in London from $1.1486 on Friday.,"[['US_Dollar', 'exchangeRate', '$1.1594'], ['US_Dollar', 'previousExchangeRate', '$1.1486'], ['US_Dollar', 'exchangeRateWithEuro', '$1.1624'], ['Euro', 'exchangeRateWithUSDollar', '$1.1624'], ['Euro', 'previousExchangeRateWithUSDollar', '$1.1486']]","[['US_Dollar', 'exchangeRate', '1.1564'], ['US_Dollar', 'previousExchangeRate', '1.1486'], ['European_Euro', 'exchangeRate', '1.0'], ['London', 'location', '7:30 a.m.']]",0.1
