id,paragraph_1,kg_1,paragraph_2,kg_2
199,"The Polar Vortex, a climatic phenomenon, has a negative impact on major automotive manufacturers such as Ford Motor Co. and Fiat Chrysler Automobiles NV. This impact is characterized by disruptions in production and logistical challenges, which underscore the vulnerability of these companies to extreme weather conditions. Additionally, the Polar Vortex is related to broader climatic changes associated with Global Warming, indicating a link between atmospheric phenomena and global climate trends that further influence economic and industrial operations.","[[""Polar_Vortex"", ""has_impact_on"", ""Ford_Motor_Co.""], [""Polar_Vortex"", ""has_impact_on"", ""Fiat_Chrysler_Automobiles_NV""], [""Polar_Vortex"", ""characterized_by"", ""disruptions_in_production""], [""Polar_Vortex"", ""characterized_by"", ""logistical_challenges""], [""Ford_Motor_Co."", ""vulnerable_to"", ""extreme_weather_conditions""], [""Fiat_Chrysler_Automobiles_NV"", ""vulnerable_to"", ""extreme_weather_conditions""], [""Polar_Vortex"", ""related_to"", ""Global_Warming""], [""Global_Warming"", ""influence_on"", ""economic_operations""], [""Global_Warming"", ""influence_on"", ""industrial_operations""]]","The phenomenon known as the Polar Vortex has a negative impact on major automobile manufacturers such as Ford Motor Co. and Fiat Chrysler Automobiles NV. Furthermore, there is a notable correlation between the Polar Vortex and the broader issue of Global Warming, which may influence climatic conditions affecting these industries.","[[""Polar_Vortex"", ""has_impact_on"", ""Ford_Motor_Co.""], [""Polar_Vortex"", ""has_impact_on"", ""Fiat_Chrysler_Automobiles_NV""], [""Polar_Vortex"", ""correlated_with"", ""Global_Warming""], [""Global_Warming"", ""influence_on"", ""climatic_conditions""], [""climatic_conditions"", ""affect"", ""automobile_industries""]]"
200,"Sen. Mike Lee, who is related to Utah and the House, has a connection to a bill, which in turn has announced an extradition. This suggests his involvement in legislative matters concerning the extradition process, reflecting his political activities within these interconnected domains.","[[""Sen._Mike_Lee"", ""related_to"", ""Utah""], [""Sen._Mike_Lee"", ""related_to"", ""House""], [""Sen._Mike_Lee"", ""connected_to"", ""bill""], [""bill"", ""announced"", ""extradition""], [""Sen._Mike_Lee"", ""involved_in"", ""legislative_matters""], [""legislative_matters"", ""concerning"", ""extradition_process""], [""Sen._Mike_Lee"", ""engaged_in"", ""political_activities""], [""political_activities"", ""within"", ""interconnected_domains""]]","Sen. Mike Lee has a relationship with the House, indicating a connection between his actions or interests and the legislative body.","[[""Sen._Mike_Lee"", ""has_relationship_with"", ""House""], [""Sen._Mike_Lee"", ""connection_between"", ""actions_or_interests""], [""actions_or_interests"", ""related_to"", ""House""], [""House"", ""legislative_body"", ""legislative_body""]]"
201,"Ray Dalio has a negative impact on market volatility, which in turn impacts the Dow Jones Industrial Average and Meta Platforms Inc. Furthermore, market volatility also negatively impacts the inflation rate. Meta Platforms Inc. is related to both the President Trump Administration and the concept of watch, highlighting its position within the political and media landscapes.","[[""Ray_Dalio"", ""has_negative_impact_on"", ""market_volatility""], [""market_volatility"", ""impacts"", ""Dow_Jones_Industrial_Average""], [""market_volatility"", ""impacts"", ""Meta_Platforms_Inc""], [""market_volatility"", ""negatively_impacts"", ""inflation_rate""], [""Meta_Platforms_Inc"", ""related_to"", ""President_Trump_Administration""], [""Meta_Platforms_Inc"", ""related_to"", ""watch""]]","Ray Dalio has a negative impact on market volatility, which in turn affects the Dow Jones Industrial Average and also has a negative impact on the inflation rate. Furthermore, market volatility influences Meta Platforms Inc. Moreover, Meta Platforms Inc. relates to both the President Trump Administration and Watch, indicating its connections to political and media landscapes.","[[""Ray_Dalio"", ""has_negative_impact_on"", ""market_volatility""], [""market_volatility"", ""affects"", ""Dow_Jones_Industrial_Average""], [""market_volatility"", ""has_negative_impact_on"", ""inflation_rate""], [""market_volatility"", ""influences"", ""Meta_Platforms_Inc""], [""Meta_Platforms_Inc"", ""relates_to"", ""President_Trump_Administration""], [""Meta_Platforms_Inc"", ""relates_to"", ""Watch""]]"
202,"Russian trolls have operated on Twitter, causing a negative impact on Mitt Romney. These trolls are also related to the U.S. midterm elections, an event significant in shaping political discourse. Mitt Romney himself is closely associated with Utah and has relevance to the Democratic Party, illustrating his influence across political lines and geographical boundaries. The activities of Russian trolls on platforms like Twitter during the U.S. midterm elections highlight their disruptive potential in the realms where Romney is involved.","[[""Russian_trolls"", ""operated_on"", ""Twitter""], [""Russian_trolls"", ""causing_negative_impact_on"", ""Mitt_Romney""], [""Russian_trolls"", ""related_to"", ""U.S._midterm_elections""], [""U.S._midterm_elections"", ""significant_in"", ""shaping_political_discourse""], [""Mitt_Romney"", ""associated_with"", ""Utah""], [""Mitt_Romney"", ""relevant_to"", ""Democratic_Party""], [""Russian_trolls"", ""operating_on"", ""Twitter""], [""Russian_trolls"", ""disruptive_in"", ""realms_where_Romney_is_involved""], [""Mitt_Romney"", ""involved_in"", ""U.S._midterm_elections""]]","Russian Trolls have a negative impact on Mitt Romney, and their operations are mainly conducted on Twitter. Additionally, these trolls are connected to the U.S. midterm elections. Mitt Romney's activities and political affiliations relate to Utah and the Democratic Party.","[[""Russian_Trolls"", ""having_negative_impact_on"", ""Mitt_Romney""], [""Russian_Trolls"", ""operating_on"", ""Twitter""], [""Russian_Trolls"", ""connected_to"", ""U.S._midterm_elections""], [""Mitt_Romney"", ""associated_with"", ""Utah""], [""Mitt_Romney"", ""affiliated_with"", ""Democratic_Party""]]"
203,"Steve Wynn's actions have had a negative impact on the Republican Party, a political entity that operates in regions like Michigan and has control over the U.S. Congress. Despite this negative impact, he has been involved in raising the profile of the GOP. Steve Wynn also has connections relating to the University of Pennsylvania. Meanwhile, the Republican Party faces investigations, which further relate to its broader activities and influence.","[[""Steve_Wynn"", ""has_negative_impact_on"", ""Republican_Party""], [""Republican_Party"", ""operates_in"", ""Michigan""], [""Republican_Party"", ""has_control_over"", ""U.S._Congress""], [""Steve_Wynn"", ""involved_in"", ""raising_profile_of_GOP""], [""Steve_Wynn"", ""has_connections_with"", ""University_of_Pennsylvania""], [""Republican_Party"", ""faces_investigations"", ""investigations""], [""Republican_Party"", ""has_broader_activities"", ""broader_activities""], [""Republican_Party"", ""has_influence"", ""influence""]]","Steve Wynn has had a complex relationship with several entities. His actions have negatively impacted the Republican Party, yet he has also been involved in raising efforts for the GOP. Additionally, he is related to the University of Pennsylvania through unspecified connections. The Republican Party, on the other hand, controls the U.S. Congress and operates actively in Michigan. This party is also related to an investigation, showcasing its involvement in various political affairs.","[[""Steve_Wynn"", ""has_complex_relationship_with"", ""entities""], [""Steve_Wynn"", ""has_negative_impact_on"", ""Republican_Party""], [""Steve_Wynn"", ""involved_in"", ""raising_efforts_for_GOP""], [""Steve_Wynn"", ""related_to"", ""University_of_Pennsylvania""], [""Republican_Party"", ""controls"", ""U.S._Congress""], [""Republican_Party"", ""operates_in"", ""Michigan""], [""Republican_Party"", ""related_to"", ""investigation""], [""Republican_Party"", ""involved_in"", ""political_affairs""]]"
204,"Annie Donaldson is connected to the US Government, indicating a significant role or involvement within its framework. Her relationship with Donald McGahn suggests a collaboration or interaction, likely rooted in their professional engagements. Furthermore, her association with the Special counsel highlights her involvement in legal or investigative processes that may pertain to matters of national importance. This network of connections underpins her influence and relevance within these spheres.","[[""Annie_Donaldson"", ""connected_to"", ""US_Government""], [""Annie_Donaldson"", ""relationship_with"", ""Donald_McGahn""], [""Annie_Donaldson"", ""association_with"", ""Special_counsel""], [""Annie_Donaldson"", ""involved_in"", ""legal_or_investigative_processes""], [""US_Government"", ""has_involvement_in"", ""national_importance""], [""Annie_Donaldson"", ""has_influence_in"", ""national_importance""], [""Annie_Donaldson"", ""has_relevance_in"", ""US_Government""], [""Annie_Donaldson"", ""has_relevance_in"", ""legal_or_investigative_processes""]]","Annie Donaldson has notable connections with the US Government, Donald McGahn, and the Special Counsel. These relationships suggest her involvement in or influence on various legal and governmental aspects related to these entities.","[[""Annie_Donaldson"", ""connected_to"", ""US_Government""], [""Annie_Donaldson"", ""relationship_with"", ""Donald_McGahn""], [""Annie_Donaldson"", ""relationship_with"", ""Special_Counsel""], [""Annie_Donaldson"", ""involved_in"", ""legal_aspects""], [""Annie_Donaldson"", ""involved_in"", ""governmental_aspects""], [""US_Government"", ""has_legal_aspects"", ""legal_aspects""], [""US_Government"", ""has_governmental_aspects"", ""governmental_aspects""], [""Annie_Donaldson"", ""has_influence_on"", ""US_Government""], [""Annie_Donaldson"", ""has_influence_on"", ""legal_aspects""], [""Annie_Donaldson"", ""has_influence_on"", ""governmental_aspects""]]"
205,"Ray Dalio has been associated with a negative impact on market volatility, a phenomenon that significantly influences global markets. While market volatility can boost opportunities for global investors, who may benefit from the fluctuations and uncertainties, it also adversely affects the stock exchange, often leading to instability or unpredictable market conditions.","[[""Ray_Dalio"", ""associated_with"", ""negative_impact_on_market_volatility""], [""negative_impact_on_market_volatility"", ""influences"", ""global_markets""], [""market_volatility"", ""affects"", ""global_investors""], [""market_volatility"", ""boosts"", ""opportunities_for_global_investors""], [""global_investors"", ""benefit_from"", ""fluctuations""], [""global_investors"", ""benefit_from"", ""uncertainties""], [""market_volatility"", ""adversely_affects"", ""stock_exchange""], [""market_volatility"", ""leads_to"", ""instability""], [""market_volatility"", ""leads_to"", ""unpredictable_market_conditions""]]","Ray Dalio has a positive impact on market volatility. This volatility, in turn, affects global markets, influencing them in various ways. It also has a positive impact on global investors, possibly by providing opportunities for profit through dynamic trading conditions. However, increased market volatility can have a negative impact on the stock exchange, potentially leading to fluctuations and uncertainties that investors must navigate.","[[""Ray_Dalio"", ""has_positive_impact_on"", ""market_volatility""], [""market_volatility"", ""affects"", ""global_markets""], [""market_volatility"", ""influences"", ""global_markets""], [""market_volatility"", ""has_positive_impact_on"", ""global_investors""], [""market_volatility"", ""provides"", ""opportunities_for_profit""], [""market_volatility"", ""creates"", ""dynamic_trading_conditions""], [""increased_market_volatility"", ""has_negative_impact_on"", ""stock_exchange""], [""increased_market_volatility"", ""leads_to"", ""fluctuations""], [""increased_market_volatility"", ""leads_to"", ""uncertainties""], [""global_investors"", ""navigate"", ""fluctuations""], [""global_investors"", ""navigate"", ""uncertainties""]]"
206,"The Socialist Party controls Spain and operates in both Venezuela and the National Assembly. In Venezuela, the situation relates to OPEC and involves participation in economic problems. Furthermore, Venezuela has had a significant impact on the Soviet Union.","[[""Socialist_Party"", ""controls"", ""Spain""], [""Socialist_Party"", ""operates_in"", ""Venezuela""], [""Socialist_Party"", ""operates_in"", ""National_Assembly""], [""Venezuela"", ""relates_to"", ""OPEC""], [""Venezuela"", ""involves"", ""economic_problems""], [""Venezuela"", ""had_impact_on"", ""Soviet_Union""]]",The Socialist Party controls Spain and operates in Venezuela as well as the National Assembly.,"[[""Socialist_Party"", ""controls"", ""Spain""], [""Socialist_Party"", ""operates_in"", ""Venezuela""], [""Socialist_Party"", ""operates_in"", ""National_Assembly""]]"
207,"Tim Sweeney operates in Cary, N.C. and controls Epic Games Inc., a significant entity that operates in the videogame industry.","[[""Tim_Sweeney"", ""operates_in"", ""Cary_N.C.""], [""Tim_Sweeney"", ""controls"", ""Epic_Games_Inc.""], [""Epic_Games_Inc."", ""operates_in"", ""videogame_industry""]]","Tim Sweeney operates in Cary, N.C., and exercises control over Dahua Technology Co., a company that functions within the videogame industry.","[[""Tim_Sweeney"", ""operates_in"", ""Cary_N.C.""], [""Tim_Sweeney"", ""exercises_control_over"", ""Dahua_Technology_Co.""], [""Dahua_Technology_Co."", ""functions_in"", ""videogame_industry""]]"
208,"Wall Street has a negative impact on customer assets while relating to the bond market and impacting US stocks. Schwab participates in Wall Street and operates in banking services, also influencing investor expectations. Furthermore, US stocks impact China and have a tendency to decrease treasury yield.","[[""Wall_Street"", ""has_negative_impact_on"", ""customer_assets""], [""Wall_Street"", ""relates_to"", ""bond_market""], [""Wall_Street"", ""impacts"", ""US_stocks""], [""Schwab"", ""participates_in"", ""Wall_Street""], [""Schwab"", ""operates_in"", ""banking_services""], [""Schwab"", ""influences"", ""investor_expectations""], [""US_stocks"", ""impact"", ""China""], [""US_stocks"", ""decrease"", ""treasury_yield""]]","Wall Street has a negative impact on customer assets while also relating to the bond market. Additionally, Wall Street impacts US stocks, which in turn have implications for China and lead to a decrease in Treasury yield. Schwab participates in Wall Street and operates in banking services, impacting investor expectations in the process.","[[""Wall_Street"", ""has_negative_impact_on"", ""customer_assets""], [""Wall_Street"", ""relates_to"", ""bond_market""], [""Wall_Street"", ""impacts"", ""US_stocks""], [""US_stocks"", ""have_implications_for"", ""China""], [""US_stocks"", ""lead_to_decrease_in"", ""Treasury_yield""], [""Schwab"", ""participates_in"", ""Wall_Street""], [""Schwab"", ""operates_in"", ""banking_services""], [""Schwab"", ""impacts"", ""investor_expectations""]]"
209,"Productivity has a positive impact on wage gains while also relating to employees and significantly impacting Gross Domestic Product. Additionally, the tax bill impacts the market, whereas business investment decreases the tax bill and also decreases productivity. However, business investment has a positive impact on capital investments.","[[""Productivity"", ""has_positive_impact_on"", ""wage_gains""], [""Productivity"", ""relates_to"", ""employees""], [""Productivity"", ""impacts"", ""Gross_Domestic_Product""], [""tax_bill"", ""impacts"", ""market""], [""business_investment"", ""decreases"", ""tax_bill""], [""business_investment"", ""decreases"", ""productivity""], [""business_investment"", ""has_positive_impact_on"", ""capital_investments""]]","Productivity relates to employees and has an impact on Gross Domestic Product. However, it has a negative impact on wage gains. The tax bill impacts the market, and business investment decreases both the tax bill and productivity. Conversely, business investment has a positive impact on capital investments.","[[""Productivity"", ""relates_to"", ""employees""], [""Productivity"", ""has_negative_impact_on"", ""wage_gains""], [""Productivity"", ""impacts"", ""Gross_Domestic_Product""], [""tax_bill"", ""impacts"", ""market""], [""business_investment"", ""decreases"", ""tax_bill""], [""business_investment"", ""decreases"", ""productivity""], [""business_investment"", ""has_positive_impact_on"", ""capital_investments""]]"
210,"Matthew Whitaker, known for his connections to Donald Trump, operates within the Environmental Protection Agency and works in the United States.","[[""Matthew_Whitaker"", ""known_for"", ""connections_to_Donald_Trump""], [""Matthew_Whitaker"", ""operates_in"", ""Environmental_Protection_Agency""], [""Matthew_Whitaker"", ""works_in"", ""United_States""], [""Matthew_Whitaker"", ""connected_to"", ""Donald_Trump""]]","Matthew Whitaker operates in both the Environmental Protection Agency and the United States, indicating his professional involvement in these areas. His activities or affiliations relate to Donald Trump, suggesting a connection or influence between the two individuals.","[[""Matthew_Whitaker"", ""operates_in"", ""Environmental_Protection_Agency""], [""Matthew_Whitaker"", ""operates_in"", ""United_States""], [""Matthew_Whitaker"", ""related_to"", ""Donald_Trump""], [""Matthew_Whitaker"", ""has_professional_involvement_in"", ""Environmental_Protection_Agency""], [""Matthew_Whitaker"", ""has_professional_involvement_in"", ""United_States""], [""Donald_Trump"", ""has_influence_on"", ""Matthew_Whitaker""], [""Matthew_Whitaker"", ""has_connection_to"", ""Donald_Trump""]]"
211,"Randall Quarles is a member of both the U.S. Federal Reserve and Stanford University. The U.S. Federal Reserve exercises control over the Hong Kong Dollar, indicating its influence on the currency's stability and regulation.","[[""Randall_Quarles"", ""member_of"", ""U.S._Federal_Reserve""], [""Randall_Quarles"", ""member_of"", ""Stanford_University""], [""U.S._Federal_Reserve"", ""exercises_control_over"", ""Hong_Kong_Dollar""], [""U.S._Federal_Reserve"", ""influences"", ""Hong_Kong_Dollar_stability""], [""U.S._Federal_Reserve"", ""regulates"", ""Hong_Kong_Dollar""]]","Randall Quarles is a member of Stanford University, indicating his affiliation with this prestigious institution.","[[""Randall_Quarles"", ""member_of"", ""Stanford_University""], [""Randall_Quarles"", ""affiliated_with"", ""Stanford_University""]]"
212,"The United States has investigations and is related to the Farm Bill. Additionally, the United States controls Cofense Inc., which has corporations. In the context of financial markets, Shanghai impacts institutional investors and the stock market, while it is also controlled by the Chinese government. Refinitiv Holdings Ltd. controls financial information and is a member of the London Stock Exchange, which operates in the United States and has a relationship with Shanghai.","[[""United_States"", ""has"", ""investigations""], [""United_States"", ""related_to"", ""Farm_Bill""], [""United_States"", ""controls"", ""Cofense_Inc""], [""Cofense_Inc"", ""has"", ""corporations""], [""Shanghai"", ""impacts"", ""institutional_investors""], [""Shanghai"", ""impacts"", ""stock_market""], [""Shanghai"", ""controlled_by"", ""Chinese_government""], [""Refinitiv_Holdings_Ltd"", ""controls"", ""financial_information""], [""Refinitiv_Holdings_Ltd"", ""member_of"", ""London_Stock_Exchange""], [""London_Stock_Exchange"", ""operates_in"", ""United_States""], [""London_Stock_Exchange"", ""related_to"", ""Shanghai""]]","The United States has investigations and is related to the Farm Bill, while also controlling Cofense Inc., which has corporations as its assets. In Shanghai, the stock market and institutional investors are impacted, and this city is under the control of the Chinese government. Moreover, the London Stock Exchange operates in the United States and Refinitiv Holdings Ltd. controls financial information.","[[""United_States"", ""has"", ""investigations""], [""United_States"", ""related_to"", ""Farm_Bill""], [""United_States"", ""controls"", ""Cofense_Inc""], [""Cofense_Inc"", ""has"", ""corporations""], [""Shanghai"", ""impacts"", ""stock_market""], [""Shanghai"", ""impacts"", ""institutional_investors""], [""Shanghai"", ""controlled_by"", ""Chinese_government""], [""London_Stock_Exchange"", ""operates_in"", ""United_States""], [""Refinitiv_Holdings_Ltd"", ""controls"", ""financial_information""], [""Refinitiv_Holdings_Ltd"", ""related_to"", ""London_Stock_Exchange""]]"
213,"Rod Rosenstein has connections to the Federal Bureau of Investigation and operates within the jurisdiction of the United States of America. David Apol, who oversees the Office of Government Ethics, is related to Rod Rosenstein, suggesting a professional or contextual association between them.","[[""Rod_Rosenstein"", ""connected_to"", ""Federal_Bureau_of_Investigation""], [""Rod_Rosenstein"", ""operates_within"", ""United_States_of_America""], [""David_Apol"", ""oversees"", ""Office_of_Government_Ethics""], [""David_Apol"", ""related_to"", ""Rod_Rosenstein""], [""Rod_Rosenstein"", ""related_to"", ""David_Apol""]]","Rod Rosenstein, operating within the United States of America, has links to the Federal Bureau of Investigation. Additionally, David Apol controls the Office of Government Ethics and is connected to Rod Rosenstein, indicating a relationship between their roles in governmental oversight and ethics.","[[""Rod_Rosenstein"", ""connected_to"", ""Federal_Bureau_of_Investigation""], [""Rod_Rosenstein"", ""operates_within"", ""United_States_of_America""], [""David_Apol"", ""controls"", ""Office_of_Government_Ethics""], [""David_Apol"", ""connected_to"", ""Rod_Rosenstein""], [""Rod_Rosenstein"", ""connected_to"", ""David_Apol""]]"
214,"Fujifilm Holdings Corp. has a positive impact on revenue, while Xerox produces personal computers. Moreover, Xerox Corp. is related to Jeff Jacobson and has raised its profit. Additionally, Xerox Corp. is also related to Fujifilm Holdings Corp. However, Jeff Jacobson has a negative impact on Xerox.","[[""Fujifilm_Holdings_Corp."", ""has_positive_impact_on"", ""revenue""], [""Xerox"", ""produces"", ""personal_computers""], [""Xerox_Corp."", ""related_to"", ""Jeff_Jacobson""], [""Xerox_Corp."", ""raises"", ""profit""], [""Xerox_Corp."", ""related_to"", ""Fujifilm_Holdings_Corp.""], [""Jeff_Jacobson"", ""has_negative_impact_on"", ""Xerox""]]","Fujifilm Holdings Corp. has a positive impact on revenue, highlighting its influence on financial performance. Xerox produces personal computers, contributing to its market presence and product offerings. Xerox Corp. is related to Jeff Jacobson, indicating a connection between the two entities. Additionally, Xerox Corp. raises profit, which further emphasizes its financial strategies. The relationship between Xerox Corp. and Fujifilm Holdings Corp. suggests a business link that may affect their operational dynamics. However, Jeff Jacobson negatively impacts Xerox, suggesting that his association with the company may have adverse effects on its performance.","[[""Fujifilm_Holdings_Corp."", ""has_positive_impact_on"", ""revenue""], [""Fujifilm_Holdings_Corp."", ""influences"", ""financial_performance""], [""Xerox"", ""produces"", ""personal_computers""], [""Xerox"", ""contributes_to"", ""market_presence""], [""Xerox"", ""contributes_to"", ""product_offerings""], [""Xerox_Corp."", ""related_to"", ""Jeff_Jacobson""], [""Xerox_Corp."", ""raises"", ""profit""], [""Xerox_Corp."", ""employs"", ""financial_strategies""], [""Xerox_Corp."", ""related_to"", ""Fujifilm_Holdings_Corp.""], [""Xerox_Corp."", ""linked_to"", ""Fujifilm_Holdings_Corp.""], [""Jeff_Jacobson"", ""associated_with"", ""Xerox""], [""Jeff_Jacobson"", ""has_negative_impact_on"", ""Xerox""]]"
215,"The S&P500 raises the Dow Industrials, while also impacting investor confidence. Additionally, Credit Suisse relates to both Private Equity Funds and collusion, as well as to the S&P500.","[[""S&P500"", ""raises"", ""Dow_Industrials""], [""S&P500"", ""impacts"", ""investor_confidence""], [""Credit_Suisse"", ""relates_to"", ""Private_Equity_Funds""], [""Credit_Suisse"", ""relates_to"", ""collusion""], [""Credit_Suisse"", ""relates_to"", ""S&P500""]]","The S&P500 impacts investor confidence and is associated with a decrease in the Dow Industrials. Additionally, Credit Suisse relates to Private Equity Funds and collusion, and has connections with the S&P500 as well.","[[""S&P500"", ""impacts"", ""investor_confidence""], [""S&P500"", ""associated_with"", ""decrease_in_Dow_Industrials""], [""Credit_Suisse"", ""relates_to"", ""Private_Equity_Funds""], [""Credit_Suisse"", ""relates_to"", ""collusion""], [""Credit_Suisse"", ""has_connections_with"", ""S&P500""]]"
