id,paragraph_1,kg_1,paragraph_2,kg_2
93,"U.S. Economic Data exerts a significant influence on U.S. stocks and the U.S. Dollar, often affecting market trends and economic decisions. This data, however, can have a negative impact on the Treasury, which in turn influences the activities and strategies of market participants.","[[""U.S._Economic_Data"", ""exerts_influence_on"", ""U.S._stocks""], [""U.S._Economic_Data"", ""exerts_influence_on"", ""U.S._Dollar""], [""U.S._Economic_Data"", ""affects"", ""market_trends""], [""U.S._Economic_Data"", ""affects"", ""economic_decisions""], [""U.S._Economic_Data"", ""has_negative_impact_on"", ""Treasury""], [""Treasury"", ""influences"", ""market_participants""], [""Treasury"", ""influences"", ""activities_of_market_participants""], [""Treasury"", ""influences"", ""strategies_of_market_participants""]]","U.S. Economic Data exerts a powerful influence over the financial landscape, with notable impacts on both U.S. stocks and the U.S. Dollar. However, this data can have a negative impact on the Treasury, which, in turn, significantly affects market participants.","[[""U.S._Economic_Data"", ""exerts_influence_on"", ""U.S._stocks""], [""U.S._Economic_Data"", ""exerts_influence_on"", ""U.S._Dollar""], [""U.S._Economic_Data"", ""exerts_influence_on"", ""financial_landscape""], [""U.S._Economic_Data"", ""has_negative_impact_on"", ""Treasury""], [""Treasury"", ""affects"", ""market_participants""]]"
94,"New York exerts control over New York State and influential entities like Meta Platforms Inc., while also serving as a hub for technology companies. Sean Patrick Maloney plays a significant role in this vibrant locale by introducing the New York Attorney General, operating actively within New York's dynamic environment, and participating in significant political events such as the New York Democratic Primary.","[[""New_York"", ""exerts_control_over"", ""New_York_State""], [""New_York"", ""exerts_control_over"", ""Meta_Platforms_Inc""], [""New_York"", ""hub_for"", ""technology_companies""], [""Sean_Patrick_Maloney"", ""introduces"", ""New_York_Attorney_General""], [""Sean_Patrick_Maloney"", ""operates_in"", ""New_York""], [""Sean_Patrick_Maloney"", ""participates_in"", ""New_York_Democratic_Primary""]]","New York exerts control over Djibouti and Meta Platforms Inc., showcasing its influence in these regions and companies. Furthermore, New York operates in the realm of technology companies, indicating its active involvement in this sector. In a related political and economic context, Michael Gove has introduced the Department of Commerce, potentially expanding its reach and impact. Additionally, Michael Gove operates within New York, highlighting his role and activities in this city, and actively participates in the New York Democratic Primary, which could influence political outcomes in the region.","[[""New_York"", ""exerts_control_over"", ""Djibouti""], [""New_York"", ""exerts_control_over"", ""Meta_Platforms_Inc""], [""New_York"", ""operates_in"", ""technology_companies""], [""Michael_Gove"", ""introduces"", ""Department_of_Commerce""], [""Michael_Gove"", ""operates_in"", ""New_York""], [""Michael_Gove"", ""participates_in"", ""New_York_Democratic_Primary""], [""Department_of_Commerce"", ""potentially_expands_reach_in"", ""New_York""]]"
95,"Kellyanne Conway, who is a member of the Trump campaign, has associations with both the House committee and Elijah Cummings. Elijah Cummings notably controls entities such as the Committee and the House Oversight Committee, illustrating his influential role in governance and oversight activities.","[[""Kellyanne_Conway"", ""member_of"", ""Trump_campaign""], [""Kellyanne_Conway"", ""associated_with"", ""House_committee""], [""Kellyanne_Conway"", ""associated_with"", ""Elijah_Cummings""], [""Elijah_Cummings"", ""controls"", ""Committee""], [""Elijah_Cummings"", ""controls"", ""House_Oversight_Committee""], [""Elijah_Cummings"", ""has_influential_role_in"", ""governance""], [""Elijah_Cummings"", ""has_influential_role_in"", ""oversight_activities""]]","Kellyanne Conway is a member of the Trump campaign and has connections with the House committee as well as with Elijah Cummings. Elijah Cummings controls both the Committee and the House Oversight Committee, establishing his significant influence within these legislative bodies.","[[""Kellyanne_Conway"", ""member_of"", ""Trump_campaign""], [""Kellyanne_Conway"", ""connected_with"", ""House_committee""], [""Kellyanne_Conway"", ""connected_with"", ""Elijah_Cummings""], [""Elijah_Cummings"", ""controls"", ""Committee""], [""Elijah_Cummings"", ""controls"", ""House_Oversight_Committee""], [""Elijah_Cummings"", ""has_significant_influence_in"", ""legislative_bodies""]]"
96,"Mergers and acquisitions have a positive impact on the health-care market while also significantly impacting the global economy and financial markets. These influences on financial markets, in turn, have a direct impact on interest rates. Additionally, this dynamic is associated with a decrease in the likelihood of an interest-rate increase.","[[""Mergers_and_acquisitions"", ""have_positive_impact_on"", ""health-care_market""], [""Mergers_and_acquisitions"", ""impact"", ""global_economy""], [""Mergers_and_acquisitions"", ""impact"", ""financial_markets""], [""Influences_on_financial_markets"", ""have_direct_impact_on"", ""interest_rates""], [""Mergers_and_acquisitions"", ""associated_with"", ""decrease_in_likelihood_of_interest-rate_increase""]]","Mergers and acquisitions have a positive impact on the Health-Care Market by potentially increasing efficiencies and driving innovation. These activities also play a significant role in shaping the Global Economy and influence Financial markets through changes in corporate structures and investment strategies. As financial markets respond to such mergers and acquisitions, there is an impact on Interest Rates, which are crucial for economic decision-making. Additionally, activity in the financial markets can lead to a decrease in the likelihood of an Interest-Rate Increase, reflecting adjustments in investor expectations and market conditions.","[[""Mergers_and_acquisitions"", ""have_positive_impact_on"", ""Health-Care_Market""], [""Mergers_and_acquisitions"", ""increase"", ""efficiencies""], [""Mergers_and_acquisitions"", ""drive"", ""innovation""], [""Mergers_and_acquisitions"", ""shape"", ""Global_Economy""], [""Mergers_and_acquisitions"", ""influence"", ""Financial_markets""], [""Mergers_and_acquisitions"", ""change"", ""corporate_structures""], [""Mergers_and_acquisitions"", ""change"", ""investment_strategies""], [""Financial_markets"", ""respond_to"", ""Mergers_and_acquisitions""], [""Financial_markets"", ""impact"", ""Interest_Rates""], [""Interest_Rates"", ""crucial_for"", ""economic_decision-making""], [""Financial_markets"", ""lead_to"", ""decrease_in_likelihood_of_Interest-Rate_Increase""], [""Decrease_in_likelihood_of_Interest-Rate_Increase"", ""reflect"", ""adjustments_in_investor_expectations""], [""Decrease_in_likelihood_of_Interest-Rate_Increase"", ""reflect"", ""market_conditions""]]"
97,"Lawmakers operate within the state government and have a connection to Donald Trump. Mrs. Theresa May exerts control over immigration policies and also has authority over lawmakers, while operating in Northern Ireland. Jeremy Corbyn has announced a new strategy and is related to both Mrs. Theresa May and Hezbollah. Hezbollah, which operates in Tehran, has connections to the Syria conflict and Saudi Arabia.","[[""Lawmakers"", ""operate_in"", ""state_government""], [""Lawmakers"", ""connected_to"", ""Donald_Trump""], [""Mrs._Theresa_May"", ""exerts_control_over"", ""immigration_policies""], [""Mrs._Theresa_May"", ""exerts_control_over"", ""Lawmakers""], [""Mrs._Theresa_May"", ""operates_in"", ""Northern_Ireland""], [""Jeremy_Corbyn"", ""announced"", ""new_strategy""], [""Jeremy_Corbyn"", ""related_to"", ""Mrs._Theresa_May""], [""Jeremy_Corbyn"", ""related_to"", ""Hezbollah""], [""Hezbollah"", ""operates_in"", ""Tehran""], [""Hezbollah"", ""connected_to"", ""Syria_conflict""], [""Hezbollah"", ""connected_to"", ""Saudi_Arabia""]]","Lawmakers operate within the framework of the State Government and maintain a connection to Donald Trump. Mrs. Theresa May holds the reins over both Immigration Policies and lawmakers, while also operating in Northern Ireland. Jeremy Corbyn has announced a new strategy, tying his actions to Mrs. Theresa May and also having connections to Hezbollah. Hezbollah is related to Saudi Arabia, operates with a presence in Tehran, and has links to the Syria Conflict.","[[""Lawmakers"", ""operate_in"", ""State_Government""], [""Lawmakers"", ""connected_to"", ""Donald_Trump""], [""Mrs._Theresa_May"", ""holds_reins_over"", ""Immigration_Policies""], [""Mrs._Theresa_May"", ""holds_reins_over"", ""Lawmakers""], [""Mrs._Theresa_May"", ""operates_in"", ""Northern_Ireland""], [""Jeremy_Corbyn"", ""announced"", ""new_strategy""], [""Jeremy_Corbyn"", ""connected_to"", ""Mrs._Theresa_May""], [""Jeremy_Corbyn"", ""connected_to"", ""Hezbollah""], [""Hezbollah"", ""operates_in"", ""Tehran""], [""Hezbollah"", ""related_to"", ""Saudi_Arabia""], [""Hezbollah"", ""linked_to"", ""Syria_Conflict""]]"
98,"The Cboe Volatility Index, which operates on Wall Street, has a significant impact on both stocks and the entire US Stock Market. In turn, stocks can adversely affect the U.S. Dollar and have a broader impact on retailers.","[[""Cboe_Volatility_Index"", ""operates_on"", ""Wall_Street""], [""Cboe_Volatility_Index"", ""impact_on"", ""stocks""], [""Cboe_Volatility_Index"", ""impact_on"", ""US_Stock_Market""], [""stocks"", ""adversely_affect"", ""U.S._Dollar""], [""stocks"", ""impact_on"", ""retailers""]]","The Cboe Volatility Index, which operates on Wall Street, significantly impacts both the US Stock Market and stocks in general. This influence on stocks, in turn, negatively impacts the U.S. Dollar and affects retailers.","[[""Cboe_Volatility_Index"", ""operates_on"", ""Wall_Street""], [""Cboe_Volatility_Index"", ""impact_on"", ""US_Stock_Market""], [""Cboe_Volatility_Index"", ""impact_on"", ""stocks""], [""stocks"", ""negatively_impact"", ""U.S._Dollar""], [""stocks"", ""affect"", ""retailers""]]"
99,"Wage gains have a negative impact on Fed Policy and also significantly impact inflation. Furthermore, wage gains relate to economic expansion, which participates in global growth and relates to tax cuts. Inflation negatively impacts bond prices while concurrently having a positive impact on the Federal Reserve interest rate. Additionally, inflation impacts the Pakistan economy. Economic expansion is associated with economists, highlighting the interconnectedness between these financial aspects.","[[""Wage_gains"", ""negative_impact_on"", ""Fed_Policy""], [""Wage_gains"", ""significant_impact_on"", ""inflation""], [""Wage_gains"", ""relate_to"", ""economic_expansion""], [""Economic_expansion"", ""participates_in"", ""global_growth""], [""Economic_expansion"", ""relates_to"", ""tax_cuts""], [""Inflation"", ""negative_impact_on"", ""bond_prices""], [""Inflation"", ""positive_impact_on"", ""Federal_Reserve_interest_rate""], [""Inflation"", ""impacts"", ""Pakistan_economy""], [""Economic_expansion"", ""associated_with"", ""economists""]]","Wage gains have a significant impact on inflation and are also related to economic expansion. These wage gains exert a positive impact on Fed policy, suggesting that as wages rise, policymakers may adjust their strategies accordingly. In turn, inflation negatively impacts bond prices while simultaneously having a positive effect on the Federal Reserve interest rate. Furthermore, inflation affects the Pakistan economy. Economic expansion, which relates to both economists and tax cuts, plays an active role in participating in global growth, highlighting its importance in the broader economic landscape.","[[""Wage_gains"", ""significant_impact_on"", ""inflation""], [""Wage_gains"", ""related_to"", ""economic_expansion""], [""Wage_gains"", ""positive_impact_on"", ""Fed_policy""], [""Inflation"", ""negative_impact_on"", ""bond_prices""], [""Inflation"", ""positive_effect_on"", ""Federal_Reserve_interest_rate""], [""Inflation"", ""affects"", ""Pakistan_economy""], [""Economic_expansion"", ""relates_to"", ""economists""], [""Economic_expansion"", ""relates_to"", ""tax_cuts""], [""Economic_expansion"", ""participates_in"", ""global_growth""]]"
100,"FBI Director Christopher Wray is a member of the President Trump Administration, which has control over health policy and also influences Nancy Pelosi and the inflation measure. Additionally, FBI Director Christopher Wray controls the Federal Bureau of Investigation, indicating his authoritative role within that agency.","[[""Christopher_Wray"", ""member_of"", ""President_Trump_Administration""], [""President_Trump_Administration"", ""control_over"", ""health_policy""], [""President_Trump_Administration"", ""influences"", ""Nancy_Pelosi""], [""President_Trump_Administration"", ""influences"", ""inflation_measure""], [""Christopher_Wray"", ""controls"", ""Federal_Bureau_of_Investigation""]]","FBI Director Christopher Wray is a member of the President Trump Administration and controls the Federal Bureau of Investigation. The President Trump Administration also has control over health policy and impacts figures such as Nancy Pelosi, as well as influencing inflation measures.","[[""Christopher_Wray"", ""member_of"", ""President_Trump_Administration""], [""Christopher_Wray"", ""controls"", ""Federal_Bureau_of_Investigation""], [""President_Trump_Administration"", ""control_over"", ""health_policy""], [""President_Trump_Administration"", ""impacts"", ""Nancy_Pelosi""], [""President_Trump_Administration"", ""influences"", ""inflation_measures""]]"
101,"Kirstjen Nielsen relates to the Department of Homeland Security and has oversight of Immigration Proceedings while also relating to issues concerning the border. The Department of Homeland Security operates in areas such as Security and the Inspector General Report, and it controls the U.S. Citizenship and Immigration Services. This agency is responsible for announcing New Rules and also controls the Asylum Application process while operating in U.S. courts.","[[""Kirstjen_Nielsen"", ""relates_to"", ""Department_of_Homeland_Security""], [""Kirstjen_Nielsen"", ""oversight_of"", ""Immigration_Proceedings""], [""Kirstjen_Nielsen"", ""relates_to"", ""border""], [""Department_of_Homeland_Security"", ""operates_in"", ""Security""], [""Department_of_Homeland_Security"", ""operates_in"", ""Inspector_General_Report""], [""Department_of_Homeland_Security"", ""controls"", ""U.S._Citizenship_and_Immigration_Services""], [""U.S._Citizenship_and_Immigration_Services"", ""announces"", ""New_Rules""], [""U.S._Citizenship_and_Immigration_Services"", ""controls"", ""Asylum_Application_process""], [""U.S._Citizenship_and_Immigration_Services"", ""operates_in"", ""U.S._courts""]]",Kirstjen Nielsen has authority over Immigration Proceedings and is related to the border. The Department of Homeland Security operates in the domains of Security and the Inspector General Report. U.S. Citizenship and Immigration Services announces New Rules while controlling the Asylum Application process and operating within U.S. courts.,"[[""Kirstjen_Nielsen"", ""authority_over"", ""Immigration_Proceedings""], [""Kirstjen_Nielsen"", ""related_to"", ""border""], [""Department_of_Homeland_Security"", ""operates_in"", ""Security""], [""Department_of_Homeland_Security"", ""operates_in"", ""Inspector_General_Report""], [""U.S._Citizenship_and_Immigration_Services"", ""announces"", ""New_Rules""], [""U.S._Citizenship_and_Immigration_Services"", ""controls"", ""Asylum_Application_process""], [""U.S._Citizenship_and_Immigration_Services"", ""operates_in"", ""U.S._courts""]]"
102,"Amy Coney Barrett, who operates in Indiana, has a Supreme Court nomination. This nomination is connected to the Republican Party, highlighting the political context surrounding her candidacy. Furthermore, Amy Coney Barrett is also associated with religious conservatives, which underscores an additional layer of support within certain ideological groups.","[[""Amy_Coney_Barrett"", ""operates_in"", ""Indiana""], [""Amy_Coney_Barrett"", ""has"", ""Supreme_Court_nomination""], [""Supreme_Court_nomination"", ""connected_to"", ""Republican_Party""], [""Amy_Coney_Barrett"", ""associated_with"", ""Religious_Conservatives""]]","Amy Coney Barrett, known for her connections with Religious Conservatives, holds a Supreme Court nomination. This nomination is related to broader societal issues, including those addressed by the Campaign for a Commercial-Free Childhood. While her influence extends to diverse regions, Amy Coney Barrett also operates in Libya, bringing attention to her role on the international stage.","[[""Amy_Coney_Barrett"", ""holds"", ""Supreme_Court_nomination""], [""Supreme_Court_nomination"", ""related_to"", ""broader_societal_issues""], [""Supreme_Court_nomination"", ""addresses_issues_of"", ""Campaign_for_a_Commercial-Free_Childhood""], [""Amy_Coney_Barrett"", ""connected_to"", ""Religious_Conservatives""], [""Amy_Coney_Barrett"", ""operates_in"", ""Libya""]]"
103,"Joseph Otting operates in the Office of the Comptroller of the Currency, and he also relates to the Consumer Financial Protection Bureau. Additionally, Joseph Otting has control over Wells Fargo, reflecting his significant influence within the financial regulatory landscape.","[[""Joseph_Otting"", ""operates_in"", ""Office_of_the_Comptroller_of_the_Currency""], [""Joseph_Otting"", ""relates_to"", ""Consumer_Financial_Protection_Bureau""], [""Joseph_Otting"", ""has_control_over"", ""Wells_Fargo""]]","Marc Short operates in the Federal Reserve Bank of San Francisco and has a relationship with the Consumer Financial Protection Bureau. Additionally, Marc Short controls Helix Opco LLC, indicating a significant influence over this entity.","[[""Marc_Short"", ""operates_in"", ""Federal_Reserve_Bank_of_San_Francisco""], [""Marc_Short"", ""has_relationship_with"", ""Consumer_Financial_Protection_Bureau""], [""Marc_Short"", ""controls"", ""Helix_Opco_LLC""]]"
104,"Cat Zakrzewski, who operates in the tech sector, is a member of WSJ and has contributed to raising the profile of The Wall Street Journal through her work.","[[""Cat_Zakrzewski"", ""operates_in"", ""tech_sector""], [""Cat_Zakrzewski"", ""member_of"", ""WSJ""], [""Cat_Zakrzewski"", ""contributes_to"", ""The_Wall_Street_Journal""], [""Cat_Zakrzewski"", ""raises_profile_of"", ""The_Wall_Street_Journal""]]","Cat Zakrzewski is a member of WSJ and operates in the tech sector. Additionally, Cat Zakrzewski plays a role in decreasing the influence or perhaps certain aspects of The Wall Street Journal in relation to her work.","[[""Cat_Zakrzewski"", ""member_of"", ""WSJ""], [""Cat_Zakrzewski"", ""operates_in"", ""tech_sector""], [""Cat_Zakrzewski"", ""decreases_influence_of"", ""The_Wall_Street_Journal""]]"
105,"Matt Bevin is connected to the realms of economic development, showcasing his interest or involvement in matters that pertain to financial growth and policies. His name also surfaces in discussions surrounding the impeachment inquiry, indicating a possible link or relevance to political investigations and legal proceedings. Furthermore, Matt Bevin shares a relationship with Donald Trump, which might encompass political affiliations, shared policies, or mutual influence in the political and economic landscape.","[[""Matt_Bevin"", ""connected_to"", ""economic_development""], [""Matt_Bevin"", ""interested_in"", ""financial_growth""], [""Matt_Bevin"", ""involved_in"", ""policies""], [""Matt_Bevin"", ""mentioned_in"", ""impeachment_inquiry""], [""Matt_Bevin"", ""related_to"", ""political_investigations""], [""Matt_Bevin"", ""related_to"", ""legal_proceedings""], [""Matt_Bevin"", ""shares_relationship_with"", ""Donald_Trump""], [""Matt_Bevin"", ""possibly_linked_to"", ""political_affiliations""], [""Matt_Bevin"", ""possibly_linked_to"", ""shared_policies""], [""Matt_Bevin"", ""possibly_linked_to"", ""mutual_influence""], [""Donald_Trump"", ""has_relationship_with"", ""Matt_Bevin""]]","Jason Van Dyke is connected through several significant developments, including a new law, an impeachment inquiry, and the discourse surrounding presidential candidates. These relationships indicate the influence or relevance of Jason Van Dyke within various legal and political contexts.","[[""Jason_Van_Dyke"", ""connected_to"", ""new_law""], [""Jason_Van_Dyke"", ""connected_to"", ""impeachment_inquiry""], [""Jason_Van_Dyke"", ""connected_to"", ""discourse_surrounding_presidential_candidates""], [""Jason_Van_Dyke"", ""has_influence_in"", ""legal_contexts""], [""Jason_Van_Dyke"", ""has_influence_in"", ""political_contexts""], [""new_law"", ""related_to"", ""Jason_Van_Dyke""], [""impeachment_inquiry"", ""related_to"", ""Jason_Van_Dyke""], [""discourse_surrounding_presidential_candidates"", ""related_to"", ""Jason_Van_Dyke""]]"
106,"Sheryl Sandberg operates in Meta Platforms Inc. and is a member of the Chief Operating Officer position. Additionally, Sheryl Sandberg relates to the Senate Intelligence Committee, which has James Comey as a notable figure. The Senate Intelligence Committee also relates to the topics of Russian election interference and Russia Interference.","[[""Sheryl_Sandberg"", ""operates_in"", ""Meta_Platforms_Inc""], [""Sheryl_Sandberg"", ""member_of"", ""Chief_Operating_Officer""], [""Sheryl_Sandberg"", ""relates_to"", ""Senate_Intelligence_Committee""], [""James_Comey"", ""notable_figure_of"", ""Senate_Intelligence_Committee""], [""Senate_Intelligence_Committee"", ""relates_to"", ""Russian_election_interference""], [""Senate_Intelligence_Committee"", ""relates_to"", ""Russia_Interference""]]","Sheryl Sandberg operates in Meta Platforms Inc. and serves as the Chief Operating Officer of the company. Meanwhile, the Senate Intelligence Committee has James Comey as a member, and it relates to issues surrounding Russian election interference, as well as other aspects of Russia Interference.","[[""Sheryl_Sandberg"", ""operates_in"", ""Meta_Platforms_Inc""], [""Sheryl_Sandberg"", ""serves_as"", ""Chief_Operating_Officer""], [""Sheryl_Sandberg"", ""works_at"", ""Meta_Platforms_Inc""], [""James_Comey"", ""member_of"", ""Senate_Intelligence_Committee""], [""Senate_Intelligence_Committee"", ""relates_to"", ""Russian_election_interference""], [""Senate_Intelligence_Committee"", ""relates_to"", ""Russia_Interference""]]"
107,"Ukraine has a notable relationship with issues of corruption. An impeachment inquiry, which is related to Ukraine, notably impacted Donald Trump. In the context of the impeachment inquiry, House Committees play a significant role, operating within this process and exercising control over the issuance of subpoenas.","[[""Ukraine"", ""related_to"", ""issues_of_corruption""], [""impeachment_inquiry"", ""related_to"", ""Ukraine""], [""impeachment_inquiry"", ""impacted"", ""Donald_Trump""], [""House_Committees"", ""play_significant_role_in"", ""impeachment_inquiry""], [""House_Committees"", ""operate_within"", ""impeachment_inquiry""], [""House_Committees"", ""exercise_control_over"", ""issuance_of_subpoenas""]]","Ukraine has been related to issues of corruption, a topic that has gained significant attention in recent times. One notable event impacting this discourse is the impeachment inquiry, which affects Donald Trump and is also related to Ukraine itself. In the context of this inquiry, House Committees possess control over subpoenas, an essential tool in their investigative process.","[[""Ukraine"", ""related_to"", ""issues_of_corruption""], [""issues_of_corruption"", ""gained_attention_in"", ""recent_times""], [""impeachment_inquiry"", ""related_to"", ""Ukraine""], [""impeachment_inquiry"", ""affects"", ""Donald_Trump""], [""impeachment_inquiry"", ""related_to"", ""Ukraine""], [""House_Committees"", ""possess_control_over"", ""subpoenas""], [""subpoenas"", ""essential_tool_in"", ""investigative_process""], [""House_Committees"", ""part_of"", ""investigative_process""]]"
