id,paragraph_1,kg_1,paragraph_2,kg_2
310,"Peter W. Smith has raised funds and is connected to various investment opportunities. Furthermore, Peter W. Smith is also related to Michael Flynn, suggesting a relationship or association in a context that may involve finance or policy.","[[""Peter_W._Smith"", ""raised"", ""funds""], [""Peter_W._Smith"", ""connected_to"", ""investment_opportunities""], [""Peter_W._Smith"", ""related_to"", ""Michael_Flynn""], [""Michael_Flynn"", ""associated_with"", ""Peter_W._Smith""], [""Peter_W._Smith"", ""involved_in"", ""finance""], [""Peter_W._Smith"", ""involved_in"", ""policy""]]","Peter W. Smith is related to both investment opportunities and Michael Flynn, creating a network of connections that open pathways to financial strategies and potential collaborations. However, in the context of these relationships, Peter W. Smith has experienced a decrease in funds, which could impact the dynamics of his investment strategies and associations.","[[""Peter_W._Smith"", ""related_to"", ""investment_opportunities""], [""Peter_W._Smith"", ""related_to"", ""Michael_Flynn""], [""Peter_W._Smith"", ""connected_to"", ""financial_strategies""], [""Peter_W._Smith"", ""connected_to"", ""potential_collaborations""], [""Peter_W._Smith"", ""experienced"", ""decrease_in_funds""], [""decrease_in_funds"", ""impacts"", ""investment_strategies""], [""decrease_in_funds"", ""impacts"", ""associations""], [""Peter_W._Smith"", ""involved_in"", ""investment_strategies""], [""Peter_W._Smith"", ""involved_in"", ""associations""]]"
311,"Gary Martin has connections to a Company, Gun Laws, and Aurora, suggesting a complex interplay between his activities and these entities. His association with Gun Laws might imply his involvement or influence in discussions around legislative actions in Aurora. Meanwhile, a Company has operations in London and impacts the issuance of a Subpoena, possibly showing that its activities or transactions might have legal or regulatory implications. Furthermore, this Company is also related to Economics, indicating that its operations or business model are tied to economic theories or trends. The influence of a Subpoena is significant, as it controls Tax Returns, showcasing its power in legal inquiries or investigations, particularly concerning financial matters. Moreover, a Subpoena is related to the impeachment inquiry, possibly revealing that it might play a role in political or governmental proceedings.","[[""Gary_Martin"", ""connected_to"", ""Company""], [""Gary_Martin"", ""connected_to"", ""Gun_Laws""], [""Gary_Martin"", ""connected_to"", ""Aurora""], [""Company"", ""has_operations_in"", ""London""], [""Company"", ""impacts"", ""Subpoena""], [""Company"", ""related_to"", ""Economics""], [""Gun_Laws"", ""associated_with"", ""Aurora""], [""Subpoena"", ""controls"", ""Tax_Returns""], [""Subpoena"", ""related_to"", ""impeachment_inquiry""]]","Gary Martin has connections to both gun laws and Aurora, suggesting a role or influence in discussions or events related to these topics. Additionally, a subpoena has control over tax returns, indicating its power to compel the disclosure of such financial information, and it is related to the impeachment inquiry, highlighting its significance in legal proceedings. Furthermore, an unspecified company operates in London, showing its presence in the city's business environment, and this company is related to economics, emphasizing possible contributions or impacts on economic activities in the region.","[[""Gary_Martin"", ""connected_to"", ""gun_laws""], [""Gary_Martin"", ""connected_to"", ""Aurora""], [""Company"", ""operates_in"", ""London""], [""Company"", ""related_to"", ""economics""], [""Subpoena"", ""controls"", ""tax_returns""], [""Subpoena"", ""related_to"", ""impeachment_inquiry""]]"
312,"David Gauke is associated with the Conservative party and has links to the Justice department as well as Boris Johnson. The Conservative party itself is connected to the Labour Party, reflecting the often complex interplay between these major political entities.","[[""David_Gauke"", ""associated_with"", ""Conservative_party""], [""David_Gauke"", ""linked_to"", ""Justice_department""], [""David_Gauke"", ""linked_to"", ""Boris_Johnson""], [""Conservative_party"", ""connected_to"", ""Labour_Party""]]","The Conservative party has a relationship with the Labour Party, reflecting the political dynamics between these two major political entities. While often viewed as rivals, their interactions and policies can influence each other and shape the political landscape.","[[""Conservative_party"", ""related_to"", ""Labour_Party""], [""Conservative_party"", ""influences"", ""Labour_Party""], [""Labour_Party"", ""influences"", ""Conservative_party""], [""Conservative_party"", ""interacts_with"", ""Labour_Party""], [""Labour_Party"", ""interacts_with"", ""Conservative_party""], [""Conservative_party"", ""shapes"", ""political_landscape""], [""Labour_Party"", ""shapes"", ""political_landscape""]]"
313,"The Iran Government has introduced sanctions that significantly impact the global oil markets. Operating within Tehran, the Iran Government exercises control over the Islamic Revolutionary Guard Corps, which is based in and a member of Iran. Tehran has control over oil exports and also controls the Stena Impero, a notable vessel. The Islamic Revolutionary Guard Corps is active throughout the Middle East, reinforcing its strategic importance in the region.","[[""Iran_Government"", ""introduced"", ""sanctions""], [""sanctions"", ""impact"", ""global_oil_markets""], [""Iran_Government"", ""operating_in"", ""Tehran""], [""Iran_Government"", ""exercises_control_over"", ""Islamic_Revolutionary_Guard_Corps""], [""Islamic_Revolutionary_Guard_Corps"", ""based_in"", ""Iran""], [""Islamic_Revolutionary_Guard_Corps"", ""member_of"", ""Iran""], [""Tehran"", ""has_control_over"", ""oil_exports""], [""Tehran"", ""controls"", ""Stena_Impero""], [""Islamic_Revolutionary_Guard_Corps"", ""active_in"", ""Middle_East""], [""Islamic_Revolutionary_Guard_Corps"", ""reinforcing_strategic_importance_in"", ""Middle_East""]]","The Iran Government, operating in Tehran, introduced sanctions that have had an impact on global oil markets. While Tehran exerts control over oil exports and the Stena Impero, the Iran Government also maintains control over the Islamic Revolutionary Guard Corps. This military group, primarily operating in the Middle East, is a significant entity within Iran.","[[""Iran_Government"", ""introduced"", ""sanctions""], [""sanctions"", ""impact"", ""global_oil_markets""], [""Iran_Government"", ""operating_in"", ""Tehran""], [""Tehran"", ""exerts_control_over"", ""oil_exports""], [""Tehran"", ""controls"", ""Stena_Impero""], [""Iran_Government"", ""maintains_control_over"", ""Islamic_Revolutionary_Guard_Corps""], [""Islamic_Revolutionary_Guard_Corps"", ""operating_in"", ""Middle_East""], [""Islamic_Revolutionary_Guard_Corps"", ""significant_entity_in"", ""Iran""]]"
314,"Hua Chunying, who controls the Chinese Foreign Ministry, has a relationship with Sweden, a country that is related to inflation and controls the Consumer-Price Index. Furthermore, Sweden's economy is connected to global trade tensions. The Chinese Foreign Ministry announces trade concerns and operates in China, and it also has a relationship with Hong Kong.","[[""Hua_Chunying"", ""controls"", ""Chinese_Foreign_Ministry""], [""Hua_Chunying"", ""relationship_with"", ""Sweden""], [""Sweden"", ""related_to"", ""inflation""], [""Sweden"", ""controls"", ""Consumer-Price_Index""], [""Sweden"", ""connected_to"", ""global_trade_tensions""], [""Chinese_Foreign_Ministry"", ""announces"", ""trade_concerns""], [""Chinese_Foreign_Ministry"", ""operates_in"", ""China""], [""Chinese_Foreign_Ministry"", ""relationship_with"", ""Hong_Kong""]]","Hua Chunying, who controls the Chinese Foreign Ministry, relates to Sweden. In Sweden, various economic factors exist, including a relationship with inflation and control over the Consumer-Price Index. Additionally, Sweden relates to global trade tensions. The Chinese Foreign Ministry announces trade concerns and operates in China, while it also has a relationship with Hong Kong.","[[""Hua_Chunying"", ""controls"", ""Chinese_Foreign_Ministry""], [""Hua_Chunying"", ""relates_to"", ""Sweden""], [""Sweden"", ""relationship_with"", ""inflation""], [""Sweden"", ""control_over"", ""Consumer-Price_Index""], [""Sweden"", ""relates_to"", ""global_trade_tensions""], [""Chinese_Foreign_Ministry"", ""announces"", ""trade_concerns""], [""Chinese_Foreign_Ministry"", ""operates_in"", ""China""], [""Chinese_Foreign_Ministry"", ""relationship_with"", ""Hong_Kong""]]"
315,"Private-equity has a dynamic relationship with public markets, influencing trends and practices within both sectors. It notably impacts health-care services startups by providing capital, strategic guidance, and operational support, driving innovation and growth in this field. Harvard Business School exerts considerable control over the realms of venture capital and private-equity, shaping educational programs and thought leadership in these financial areas, thereby influencing the strategies and methodologies employed within these industries. Through its guidance, Harvard Business School plays a pivotal role in the development and dissemination of best practices in private-equity and venture capital, further intertwining these domains with the broader economic landscape.","[[""Private-equity"", ""influences"", ""public_markets""], [""Private-equity"", ""influences"", ""health-care_services_startups""], [""Private-equity"", ""provides"", ""capital""], [""Private-equity"", ""provides"", ""strategic_guidance""], [""Private-equity"", ""provides"", ""operational_support""], [""Private-equity"", ""drives"", ""innovation""], [""Private-equity"", ""drives"", ""growth""], [""Harvard_Business_School"", ""exerts_control_over"", ""venture_capital""], [""Harvard_Business_School"", ""exerts_control_over"", ""private-equity""], [""Harvard_Business_School"", ""shapes"", ""educational_programs""], [""Harvard_Business_School"", ""shapes"", ""thought_leadership""], [""Harvard_Business_School"", ""influences"", ""strategies""], [""Harvard_Business_School"", ""influences"", ""methodologies""], [""Harvard_Business_School"", ""plays_role_in"", ""development_of_best_practices""], [""Harvard_Business_School"", ""plays_role_in"", ""dissemination_of_best_practices""], [""Private-equity"", ""intertwined_with"", ""economic_landscape""], [""Venture_capital"", ""intertwined_with"", ""economic_landscape""]]","Private-Equity shares a connection with Public Markets, influencing trends and investment flows. Specifically, Private-Equity has a significant impact on Health-Care Services Startups, facilitating their growth and expansion. Harvard Business School exerts control over Venture Capital and Private-Equity, guiding strategies and educational programs that shape the practices within these sectors.","[[""Private-Equity"", ""shares_connection_with"", ""Public_Markets""], [""Private-Equity"", ""influences"", ""trends""], [""Private-Equity"", ""influences"", ""investment_flows""], [""Private-Equity"", ""impacts"", ""Health-Care_Services_Startups""], [""Private-Equity"", ""facilitates"", ""growth""], [""Private-Equity"", ""facilitates"", ""expansion""], [""Harvard_Business_School"", ""exerts_control_over"", ""Venture_Capital""], [""Harvard_Business_School"", ""exerts_control_over"", ""Private-Equity""], [""Harvard_Business_School"", ""guides"", ""strategies""], [""Harvard_Business_School"", ""guides"", ""educational_programs""], [""Harvard_Business_School"", ""shapes"", ""practices""]]"
316,"Fujifilm Holdings Corp. positively impacts its revenue, an achievement that may be linked to Shigeru Ishiba, a figure associated with the company. Shigeru Ishiba is also an active participant in the Liberal Democratic Party. However, his actions or policies have been noted to have a negative impact on workers.","[[""Fujifilm_Holdings_Corp."", ""positively_impacts"", ""revenue""], [""Shigeru_Ishiba"", ""associated_with"", ""Fujifilm_Holdings_Corp.""], [""Shigeru_Ishiba"", ""member_of"", ""Liberal_Democratic_Party""], [""Shigeru_Ishiba"", ""has_negative_impact_on"", ""workers""]]","Fujifilm Holdings Corp. positively impacts its revenue through business strategies and innovations. Shigeru Ishiba, who is related to Fujifilm Holdings Corp., is actively involved in the Liberal Democratic Party, where his participation has notable political and economic implications. However, Shigeru Ishiba's actions or affiliations have negatively impacted workers, highlighting potential tensions in his policies or leadership style within the political sphere.","[[""Fujifilm_Holdings_Corp."", ""positively_impacts"", ""revenue""], [""Fujifilm_Holdings_Corp."", ""uses"", ""business_strategies""], [""Fujifilm_Holdings_Corp."", ""uses"", ""innovations""], [""Shigeru_Ishiba"", ""related_to"", ""Fujifilm_Holdings_Corp.""], [""Shigeru_Ishiba"", ""member_of"", ""Liberal_Democratic_Party""], [""Shigeru_Ishiba"", ""has_participation_with_notable_implications"", ""Liberal_Democratic_Party""], [""Shigeru_Ishiba"", ""has_negative_impact_on"", ""workers""]]"
317,"The Brexit Deal had a negative impact on Mrs. Theresa May, reflecting the challenges it posed to her leadership and political agenda. Additionally, the Brexit Extension further complicated the scenario by negatively impacting the Brexit Deal itself, adding layers of complexity to the ongoing Brexit negotiations. This extension also holds some control over the European Union, highlighting its significance in the broader political landscape. Furthermore, the Brexit negotiations have had a substantial impact on the United Kingdom, influencing its political, economic, and social environments. Through its control, the Brexit Extension shows a relationship with the vital process of Brexit negotiations.","[[""Brexit_Deal"", ""had_negative_impact_on"", ""Mrs._Theresa_May""], [""Brexit_Deal"", ""posed_challenges_to"", ""Mrs._Theresa_May_leadership""], [""Brexit_Deal"", ""posed_challenges_to"", ""Mrs._Theresa_May_political_agenda""], [""Brexit_Extension"", ""negatively_impacted"", ""Brexit_Deal""], [""Brexit_Extension"", ""added_complexity_to"", ""Brexit_negotiations""], [""Brexit_Extension"", ""holds_control_over"", ""European_Union""], [""Brexit_negotiations"", ""had_substantial_impact_on"", ""United_Kingdom""], [""Brexit_negotiations"", ""influenced"", ""United_Kingdom_political_environment""], [""Brexit_negotiations"", ""influenced"", ""United_Kingdom_economic_environment""], [""Brexit_negotiations"", ""influenced"", ""United_Kingdom_social_environment""], [""Brexit_Extension"", ""related_to"", ""Brexit_negotiations""], [""Brexit_Extension"", ""exerts_control_over"", ""Brexit_negotiations""]]","The Brexit Deal had a negative impact on Mrs. Theresa May, likely influencing her political standing and decision-making. Meanwhile, the Brexit Extension exerted a negative impact on the Brexit Deal itself, complicating the process and prolonging uncertainties. The Brexit Extension is intricately related to Brexit negotiations, as it plays a crucial role in shaping the discussions and agreements between parties. Additionally, it holds control over the European Union's stance, guiding its strategic directions concerning Brexit. These negotiations significantly impact the United Kingdom, affecting its economy, policies, and international relationships.","[[""Brexit_Deal"", ""had_negative_impact_on"", ""Mrs._Theresa_May""], [""Brexit_Deal"", ""influenced"", ""Mrs._Theresa_May_political_standing""], [""Brexit_Deal"", ""influenced"", ""Mrs._Theresa_May_decision_making""], [""Brexit_Extension"", ""exerted_negative_impact_on"", ""Brexit_Deal""], [""Brexit_Extension"", ""complicated"", ""Brexit_process""], [""Brexit_Extension"", ""prolonged"", ""uncertainties""], [""Brexit_Extension"", ""related_to"", ""Brexit_negotiations""], [""Brexit_Extension"", ""plays_crucial_role_in"", ""Brexit_negotiations""], [""Brexit_Extension"", ""holds_control_over"", ""European_Union""], [""Brexit_Extension"", ""guides"", ""European_Union_strategic_directions""], [""Brexit_negotiations"", ""significantly_impacted"", ""United_Kingdom""], [""Brexit_negotiations"", ""affected"", ""United_Kingdom_economy""], [""Brexit_negotiations"", ""affected"", ""United_Kingdom_policies""], [""Brexit_negotiations"", ""affected"", ""United_Kingdom_international_relationships""]]"
318,"North Korea operates within the domains of Economics and Justice department, demonstrating its engagement in both economic systems and legal frameworks. The discipline of Economics shares correlations with New Zealand, Central banks, and the Federal Reserve Board, highlighting the interconnected nature of global financial systems. International Olympic Committee has North Korea in its purview, indicating some level of involvement or relations between the two entities. Within the Justice department, Matthew Whitaker is a significant figure, and this department exercises control over Court Decision processes, underscoring its authoritative role within the legal system.","[[""North_Korea"", ""operates_within"", ""Economics""], [""North_Korea"", ""operates_within"", ""Justice_department""], [""Economics"", ""shares_correlations_with"", ""New_Zealand""], [""Economics"", ""shares_correlations_with"", ""Central_banks""], [""Economics"", ""shares_correlations_with"", ""Federal_Reserve_Board""], [""International_Olympic_Committee"", ""has_in_its_purview"", ""North_Korea""], [""Justice_department"", ""exercises_control_over"", ""Court_Decision_processes""], [""Matthew_Whitaker"", ""significant_figure_in"", ""Justice_department""]]","The International Olympic Committee possesses North Korea, which operates within both the fields of economics and the justice department. Economics has connections with New Zealand, central banks, and the Federal Reserve Board, indicating its influence in various global financial and policy spheres. Within the justice department, Matthew Whitaker is an important figure, and the department itself holds control over court decisions.","[[""International_Olympic_Committee"", ""possesses"", ""North_Korea""], [""North_Korea"", ""operates_within"", ""economics""], [""North_Korea"", ""operates_within"", ""justice_department""], [""economics"", ""has_connections_with"", ""New_Zealand""], [""economics"", ""has_connections_with"", ""central_banks""], [""economics"", ""has_connections_with"", ""Federal_Reserve_Board""], [""justice_department"", ""holds_control_over"", ""court_decisions""], [""Matthew_Whitaker"", ""important_figure_in"", ""justice_department""]]"
319,"The United States is related to U.S. growth, illustrating its influence and connection to domestic economic progress. The Kurdish Fighters, who operate in Syria, have a significant relationship with the United States, highlighting geopolitical ties. Additionally, the Kurdish Fighters are related to the Syrian Democratic Forces, indicating their involvement and alignment within regional military dynamics.","[[""United_States"", ""related_to"", ""U.S._growth""], [""United_States"", ""influence_on"", ""domestic_economic_progress""], [""Kurdish_Fighters"", ""operate_in"", ""Syria""], [""Kurdish_Fighters"", ""related_to"", ""United_States""], [""Kurdish_Fighters"", ""related_to"", ""Syrian_Democratic_Forces""], [""Kurdish_Fighters"", ""involved_in"", ""regional_military_dynamics""]]","The Kurdish Fighters operate in Syria and have a connection to the Syrian Democratic Forces. These fighters are also related to the United States, which itself has ties to U.S. growth, reflecting the intertwined geopolitical and economic dynamics in the region. The relationships suggest strategic interactions and potential implications for regional stability and economic development.","[[""Kurdish_Fighters"", ""operate_in"", ""Syria""], [""Kurdish_Fighters"", ""connected_to"", ""Syrian_Democratic_Forces""], [""Kurdish_Fighters"", ""related_to"", ""United_States""], [""United_States"", ""related_to"", ""U.S._growth""], [""United_States"", ""tied_to"", ""geopolitical_and_economic_dynamics""], [""Kurdish_Fighters"", ""interact_with"", ""United_States""], [""United_States"", ""impact_on"", ""regional_stability""], [""United_States"", ""impact_on"", ""economic_development""]]"
320,"New York participates in demonstrations and is related to both U.S. stocks and home prices. The opioid crisis has a significant impact on Oklahoma, the health-care industry, and the pharmaceutical sector. The Sackler family raises charitable donations and has an impact on New York, while also being related to the opioid crisis.","[[""New_York"", ""participates_in"", ""demonstrations""], [""New_York"", ""related_to"", ""U.S._stocks""], [""New_York"", ""related_to"", ""home_prices""], [""opioid_crisis"", ""impact_on"", ""Oklahoma""], [""opioid_crisis"", ""impact_on"", ""health-care_industry""], [""opioid_crisis"", ""impact_on"", ""pharmaceutical_sector""], [""Sackler_family"", ""raises"", ""charitable_donations""], [""Sackler_family"", ""impact_on"", ""New_York""], [""Sackler_family"", ""related_to"", ""opioid_crisis""]]","New York participates in demonstrations, and it relates to both U.S. stocks and home prices. The opioid crisis has a significant impact on Oklahoma, the health-care industry, and the pharmaceutical sector. Additionally, the Sackler family raises charitable donations, which highlights their involvement in the conversation surrounding the opioid crisis. The Sackler family also impacts New York and is related to the ongoing opioid crisis.","[[""New_York"", ""participates_in"", ""demonstrations""], [""New_York"", ""relates_to"", ""U.S._stocks""], [""New_York"", ""relates_to"", ""home_prices""], [""opioid_crisis"", ""impact_on"", ""Oklahoma""], [""opioid_crisis"", ""impact_on"", ""health-care_industry""], [""opioid_crisis"", ""impact_on"", ""pharmaceutical_sector""], [""Sackler_family"", ""raises"", ""charitable_donations""], [""Sackler_family"", ""highlights_involvement_in"", ""conversation_surrounding_opioid_crisis""], [""Sackler_family"", ""impact_on"", ""New_York""], [""Sackler_family"", ""related_to"", ""opioid_crisis""]]"
321,"Stocks have a negative impact on the U.S. Dollar and also impact the Nasdaq Composite. Furthermore, inflation pressures have a significant impact on the U.S. Federal Reserve as well as on consumer prices. However, inflation pressures negatively impact stocks as well, illustrating the interconnectedness between these financial entities and conditions.","[[""Stocks"", ""negative_impact_on"", ""U.S._Dollar""], [""Stocks"", ""impact_on"", ""Nasdaq_Composite""], [""inflation_pressures"", ""significant_impact_on"", ""U.S._Federal_Reserve""], [""inflation_pressures"", ""significant_impact_on"", ""consumer_prices""], [""inflation_pressures"", ""negative_impact_on"", ""Stocks""]]","Stocks have a negative impact on the U.S. Dollar, while also impacting the Nasdaq Composite. Additionally, inflation pressures have a significant impact on both the U.S. Federal Reserve and consumer prices. However, inflation pressures are concurrently having a negative impact on stocks.","[[""Stocks"", ""negative_impact_on"", ""U.S._Dollar""], [""Stocks"", ""impact_on"", ""Nasdaq_Composite""], [""inflation_pressures"", ""significant_impact_on"", ""U.S._Federal_Reserve""], [""inflation_pressures"", ""significant_impact_on"", ""consumer_prices""], [""inflation_pressures"", ""negative_impact_on"", ""Stocks""]]"
322,"Robert Kraft has an impact on the Super Bowl and possesses connections to several notable figures. He is related to Stormy Daniels, who is also associated with Donald Trump and the Trump campaign. Additionally, Robert Kraft has connections to Alan Dershowitz, who operates in the field of law and has been related to Jeffrey Epstein. This web of relationships highlights a complex network of social, legal, and political interactions.","[[""Robert_Kraft"", ""has_impact_on"", ""Super_Bowl""], [""Robert_Kraft"", ""related_to"", ""Stormy_Daniels""], [""Stormy_Daniels"", ""associated_with"", ""Donald_Trump""], [""Stormy_Daniels"", ""associated_with"", ""Trump_campaign""], [""Robert_Kraft"", ""connected_to"", ""Alan_Dershowitz""], [""Alan_Dershowitz"", ""operates_in"", ""law""], [""Alan_Dershowitz"", ""related_to"", ""Jeffrey_Epstein""], [""Robert_Kraft"", ""connected_to"", ""notable_figures""]]","Robert Kraft, a prominent figure in sports management, notably impacts the Super Bowl, a major event in American football. Apart from his contributions to sports, Kraft is related to figures such as Stormy Daniels and Alan Dershowitz. Alan Dershowitz, an attorney known for his legal expertise, operates within the field of law and has connections with Jeffrey Epstein. Stormy Daniels, a public personality, has had associations with Donald Trump and the Trump campaign. These relationships provide a multifaceted view of the social, political, and legal intersections involving these individuals.","[[""Robert_Kraft"", ""prominent_figure_in"", ""sports_management""], [""Robert_Kraft"", ""has_impact_on"", ""Super_Bowl""], [""Super_Bowl"", ""event_in"", ""American_football""], [""Robert_Kraft"", ""related_to"", ""Stormy_Daniels""], [""Robert_Kraft"", ""related_to"", ""Alan_Dershowitz""], [""Alan_Dershowitz"", ""attorney_with_expertise_in"", ""law""], [""Alan_Dershowitz"", ""connected_to"", ""Jeffrey_Epstein""], [""Stormy_Daniels"", ""associated_with"", ""Donald_Trump""], [""Stormy_Daniels"", ""associated_with"", ""Trump_campaign""]]"
