id,paragraph_1,kg_1,paragraph_2,kg_2
0,"The U.S. Economy is closely related to Gross Domestic Product, the global economic slowdown, and innovation. The Gross Domestic Product operates in Mexico and relates to both economic growth and the Canadian economy. Spending impacts the U.S. Economy, while the global economic slowdown has a negative impact on bank stocks. Furthermore, innovation not only affects technology but also has a positive impact on business and significantly influences the jobs market.","[[""U.S._Economy"", ""related_to"", ""Gross_Domestic_Product""], [""U.S._Economy"", ""related_to"", ""global_economic_slowdown""], [""U.S._Economy"", ""related_to"", ""innovation""], [""Gross_Domestic_Product"", ""operates_in"", ""Mexico""], [""Gross_Domestic_Product"", ""relates_to"", ""economic_growth""], [""Gross_Domestic_Product"", ""relates_to"", ""Canadian_economy""], [""Spending"", ""impacts"", ""U.S._Economy""], [""global_economic_slowdown"", ""has_negative_impact_on"", ""bank_stocks""], [""Innovation"", ""affects"", ""technology""], [""Innovation"", ""has_positive_impact_on"", ""business""], [""Innovation"", ""influences"", ""jobs_market""]]","The U.S. Economy relates to several key factors including Gross Domestic Product, global economic slowdown, and innovation. The Gross Domestic Product operates in Mexico and also relates to economic growth and the Canadian economy. Additionally, spending impacts the U.S. Economy, while the global economic slowdown has a negative impact on bank stocks. Innovation plays a significant role by impacting technology and the jobs market, and it has a positive impact on business.","[[""U.S._Economy"", ""relates_to"", ""Gross_Domestic_Product""], [""U.S._Economy"", ""relates_to"", ""global_economic_slowdown""], [""U.S._Economy"", ""relates_to"", ""innovation""], [""Gross_Domestic_Product"", ""operates_in"", ""Mexico""], [""Gross_Domestic_Product"", ""relates_to"", ""economic_growth""], [""Gross_Domestic_Product"", ""relates_to"", ""Canadian_economy""], [""Spending"", ""impacts"", ""U.S._Economy""], [""global_economic_slowdown"", ""has_negative_impact_on"", ""bank_stocks""], [""Innovation"", ""impacts"", ""technology""], [""Innovation"", ""impacts"", ""jobs_market""], [""Innovation"", ""has_positive_impact_on"", ""business""]]"
1,"Assad plays a central role in controlling the Syrian Conflict, a situation that has garnered international attention. His actions are closely related to the deployment of chemical weapons, which have been a significant and controversial aspect of the conflict. Additionally, Assad is a key member of the Assad regime, which underpins the political structure supporting his control and influence.","[[""Assad"", ""plays_central_role_in"", ""Syrian_Conflict""], [""Syrian_Conflict"", ""has_garnered"", ""international_attention""], [""Assad"", ""actions_related_to"", ""deployment_of_chemical_weapons""], [""deployment_of_chemical_weapons"", ""aspect_of"", ""Syrian_Conflict""], [""Assad"", ""member_of"", ""Assad_regime""], [""Assad_regime"", ""underpins"", ""political_structure""], [""political_structure"", ""supports"", ""Assad_control_and_influence""]]","Assad exerts control over the Syrian Conflict, a complex situation involving various factions and international interests. His actions and decisions within this conflict are closely related to the deployment and alleged use of chemical weapons, which has drawn widespread condemnation and scrutiny. Additionally, Assad is a pivotal figure within the Assad regime, implying his integral role and influence within the governing structure that supports him.","[[""Assad"", ""exerts_control_over"", ""Syrian_Conflict""], [""Syrian_Conflict"", ""involves"", ""various_factions""], [""Syrian_Conflict"", ""involves"", ""international_interests""], [""Assad"", ""actions_related_to"", ""deployment_and_alleged_use_of_chemical_weapons""], [""deployment_and_alleged_use_of_chemical_weapons"", ""draws"", ""widespread_condemnation""], [""deployment_and_alleged_use_of_chemical_weapons"", ""draws"", ""scrutiny""], [""Assad"", ""pivotal_figure_in"", ""Assad_regime""], [""Assad_regime"", ""implies"", ""integral_role_of_Assad""], [""Assad_regime"", ""supports"", ""Assad_influence""], [""Assad_regime"", ""part_of"", ""governing_structure""]]"
2,"Manafort is related to both Paul Manafort and Mueller, and is involved in activities that raise concerns for U.S. banks. These banks, which operate in the United States, play a crucial role in controlling the financial response to potential cyberattacks.","[[""Manafort"", ""related_to"", ""Paul_Manafort""], [""Manafort"", ""related_to"", ""Mueller""], [""Manafort"", ""involved_in"", ""activities""], [""activities"", ""raise_concerns_for"", ""U.S._banks""], [""U.S._banks"", ""operate_in"", ""United_States""], [""U.S._banks"", ""play_role_in"", ""controlling_financial_response_to_potential_cyberattacks""]]","Manafort is connected to both the Secretary of State and Mueller, suggesting a significant network of relationships possibly affecting political and legal domains. In addition to these connections, Manafort also engages in activities that raise funds for charities. These charities, operating within the United States, exercise control over initiatives such as the MeToo Movement, indicating their influence and reach within societal change efforts.","[[""Manafort"", ""connected_to"", ""Secretary_of_State""], [""Manafort"", ""connected_to"", ""Mueller""], [""Manafort"", ""engages_in"", ""activities""], [""activities"", ""raise_funds_for"", ""charities""], [""charities"", ""operate_in"", ""United_States""], [""charities"", ""exercise_control_over"", ""initiatives""], [""initiatives"", ""include"", ""MeToo_Movement""], [""charities"", ""have_influence_on"", ""societal_change_efforts""]]"
3,"Paul Achleitner controls Deutsche Bank AG and has a significant impact on Deutsche Bank. Additionally, Paul Achleitner relates to John Cryan, indicating a connection between the two in the context of their roles within the bank.","[[""Paul_Achleitner"", ""controls"", ""Deutsche_Bank_AG""], [""Paul_Achleitner"", ""has_impact_on"", ""Deutsche_Bank""], [""Paul_Achleitner"", ""relates_to"", ""John_Cryan""], [""Paul_Achleitner"", ""role_context"", ""Deutsche_Bank""], [""John_Cryan"", ""role_context"", ""Deutsche_Bank""]]","Paul Achleitner controls Deutsche Bank AG and has a notable impact on Deutsche Bank. Additionally, Paul Achleitner relates to John Cryan, indicating a connection between them within the context of the bank's leadership and strategic direction.","[[""Paul_Achleitner"", ""controls"", ""Deutsche_Bank_AG""], [""Paul_Achleitner"", ""has_impact_on"", ""Deutsche_Bank""], [""Paul_Achleitner"", ""relates_to"", ""John_Cryan""], [""Paul_Achleitner"", ""role_context"", ""Deutsche_Bank_leadership""], [""John_Cryan"", ""role_context"", ""Deutsche_Bank_leadership""], [""Deutsche_Bank_leadership"", ""involves"", ""strategic_direction""]]"
4,"The ISM relates to trading partners and has a significant impact on both the manufacturing sector and the US economy. The manufacturing sector, in turn, relates to employment and operates within the Canadian economy.","[[""ISM"", ""relates_to"", ""trading_partners""], [""ISM"", ""impact_on"", ""manufacturing_sector""], [""ISM"", ""impact_on"", ""US_economy""], [""manufacturing_sector"", ""relates_to"", ""employment""], [""manufacturing_sector"", ""operates_in"", ""Canadian_economy""]]","The ISM relates to trading partners and has an impact on the US economy. Furthermore, the manufacturing sector operates in the Canadian economy and relates to employment, highlighting the interconnectedness of these economic components across borders.","[[""ISM"", ""relates_to"", ""trading_partners""], [""ISM"", ""impact_on"", ""US_economy""], [""manufacturing_sector"", ""operates_in"", ""Canadian_economy""], [""manufacturing_sector"", ""relates_to"", ""employment""]]"
5,"The Securities and Exchange Commission controls both shareholders and the banking industry, and has a negative impact on the Bitcoin ETF. Shareholders, in turn, impact companies, while William Taylor relates to both the US Government and the Securities and Exchange Commission. Additionally, the US Government relates to the U.S.-China trade dispute and negatively impacts Kellyanne Conway, while it also has an impact on investment in China.","[[""Securities_and_Exchange_Commission"", ""controls"", ""shareholders""], [""Securities_and_Exchange_Commission"", ""controls"", ""banking_industry""], [""Securities_and_Exchange_Commission"", ""negative_impact_on"", ""Bitcoin_ETF""], [""shareholders"", ""impact"", ""companies""], [""William_Taylor"", ""relates_to"", ""US_Government""], [""William_Taylor"", ""relates_to"", ""Securities_and_Exchange_Commission""], [""US_Government"", ""relates_to"", ""U.S.-China_trade_dispute""], [""US_Government"", ""negative_impact_on"", ""Kellyanne_Conway""], [""US_Government"", ""impact_on"", ""investment_in_China""]]","William Taylor relates to the US Government, which impacts investment in China. Additionally, shareholders have an influence on companies, indicating the interconnectedness between these entities in financial and political contexts.","[[""William_Taylor"", ""relates_to"", ""US_Government""], [""US_Government"", ""impact_on"", ""investment_in_China""], [""shareholders"", ""influence_on"", ""companies""]]"
6,"Economic data relates to inflation and has an impact on trade discussions. Additionally, the market is interconnected with economic data and it significantly impacts emerging-market currencies. Furthermore, the market is a member of the United Kingdom, reflecting its broader economic landscape.","[[""Economic_data"", ""relates_to"", ""inflation""], [""Economic_data"", ""has_impact_on"", ""trade_discussions""], [""Market"", ""interconnected_with"", ""Economic_data""], [""Market"", ""has_impact_on"", ""emerging-market_currencies""], [""Market"", ""member_of"", ""United_Kingdom""]]","Economic data relates to inflation and impacts trade discussions. The market is connected to this economic data and also has an impact on emerging-market currencies. Furthermore, the market is a member of the United Kingdom, indicating its inclusion within this economic framework.","[[""Economic_data"", ""relates_to"", ""inflation""], [""Economic_data"", ""impacts"", ""trade_discussions""], [""Market"", ""connected_to"", ""Economic_data""], [""Market"", ""has_impact_on"", ""emerging-market_currencies""], [""Market"", ""member_of"", ""United_Kingdom""]]"
7,"Chinese Steelmakers are noted to negatively impact U.S. Tariffs, which have a cascading effect on multiple fronts. The tariffs impact Beijing and influence the flow of Chinese imports. These measures also have implications for consumers, who, besides being impacted by the tariffs, are members of Alphabet Inc. Additionally, consumer behavior significantly impacts GDP Growth, highlighting the interconnected nature of modern economic systems.","[[""Chinese_Steelmakers"", ""impact"", ""U.S._Tariffs""], [""U.S._Tariffs"", ""affect"", ""Beijing""], [""U.S._Tariffs"", ""influence"", ""Chinese_imports""], [""U.S._Tariffs"", ""impact"", ""consumers""], [""consumers"", ""member_of"", ""Alphabet_Inc""], [""consumer_behavior"", ""impact"", ""GDP_Growth""]]","Chinese Steelmakers have a positive impact on U.S. tariffs, adjusting foreign trade dynamics. These U.S. tariffs subsequently affect Beijing, influencing governmental strategy and policy adjustments, while equally impacting the influx of Chinese imports. Moreover, U.S. tariffs play a significant role in shaping consumer behavior and market conditions. Meanwhile, consumers contribute to the composition of market metrics as they are members of Alphabet Inc., a major tech conglomerate, and their spending patterns can influence GDP growth, highlighting the interconnected nature of global economic factors.","[[""Chinese_Steelmakers"", ""impact"", ""U.S._Tariffs""], [""U.S._Tariffs"", ""affect"", ""Beijing""], [""U.S._Tariffs"", ""influence"", ""Chinese_imports""], [""U.S._Tariffs"", ""influence"", ""governmental_strategy""], [""U.S._Tariffs"", ""influence"", ""policy_adjustments""], [""U.S._Tariffs"", ""shape"", ""consumer_behavior""], [""U.S._Tariffs"", ""shape"", ""market_conditions""], [""consumers"", ""member_of"", ""Alphabet_Inc""], [""consumers"", ""contribute_to"", ""market_metrics""], [""consumer_spending_patterns"", ""influence"", ""GDP_Growth""]]"
8,"Blackstone has a significant relationship with Wall Street and actively invests in Switzerland. Furthermore, Blackstone operates in Saudi Arabia. Switzerland is interconnected with various international economic elements, such as trade deficits, the European Union, and China.","[[""Blackstone"", ""significant_relationship_with"", ""Wall_Street""], [""Blackstone"", ""actively_invests_in"", ""Switzerland""], [""Blackstone"", ""operates_in"", ""Saudi_Arabia""], [""Switzerland"", ""interconnected_with"", ""trade_deficits""], [""Switzerland"", ""interconnected_with"", ""European_Union""], [""Switzerland"", ""interconnected_with"", ""China""]]","Blackstone, a prominent financial entity, has various connections and operations that highlight its significant role in global finance. It relates to Wall Street, showcasing its involvement with one of the world's major financial centers. Furthermore, Blackstone invests in Switzerland, a country known for its banking prowess and strategic economic alliances. In addition to this investment, Blackstone operates in Saudi Arabia, indicating a diverse geographic span of activities. Switzerland itself maintains connections with several important economic factors; it relates to trade deficits, signaling its role in international trade dynamics. Additionally, Switzerland has established relationships with the European Union and China, two influential players in global commerce and economics.","[[""Blackstone"", ""prominent_financial_entity"", ""global_finance""], [""Blackstone"", ""relates_to"", ""Wall_Street""], [""Blackstone"", ""invests_in"", ""Switzerland""], [""Switzerland"", ""known_for"", ""banking_prowess""], [""Switzerland"", ""known_for"", ""strategic_economic_alliances""], [""Blackstone"", ""operates_in"", ""Saudi_Arabia""], [""Switzerland"", ""maintains_connections_with"", ""trade_deficits""], [""Switzerland"", ""related_to"", ""international_trade_dynamics""], [""Switzerland"", ""established_relationships_with"", ""European_Union""], [""Switzerland"", ""established_relationships_with"", ""China""], [""European_Union"", ""influential_player_in"", ""global_commerce""], [""China"", ""influential_player_in"", ""global_economics""]]"
9,"The investigation, which has an impact on Tesla Inc., is related to Congress, highlighting its broader significance. Robert Swan plays a pivotal role in controlling this investigation, as well as overseeing the Community involved in it. This web of interactions underscores the complexity of the situation and the significant influence Robert Swan holds within this context.","[[""investigation"", ""impact_on"", ""Tesla_Inc.""], [""investigation"", ""related_to"", ""Congress""], [""Robert_Swan"", ""controls"", ""investigation""], [""Robert_Swan"", ""oversees"", ""Community""], [""Robert_Swan"", ""plays_pivotal_role_in"", ""investigation""], [""investigation"", ""involves"", ""Community""], [""Robert_Swan"", ""holds_influence_in"", ""context""]]","Steve Penny has control over an investigation as well as the Community, guiding the direction and development of both. This investigation impacts Tesla Inc., shedding light on potential influences or outcomes related to the company. Furthermore, the investigation is related to the Military, suggesting broader implications that may affect both sectors.","[[""Steve_Penny"", ""controls"", ""investigation""], [""Steve_Penny"", ""controls"", ""Community""], [""Steve_Penny"", ""guides"", ""investigation""], [""Steve_Penny"", ""guides"", ""Community""], [""investigation"", ""impact_on"", ""Tesla_Inc.""], [""investigation"", ""related_to"", ""Military""], [""investigation"", ""sheds_light_on"", ""potential_influences_or_outcomes""], [""potential_influences_or_outcomes"", ""related_to"", ""Tesla_Inc.""]]"
10,"The American Federation of Government Employees significantly impacts Federal Workers through its various activities and advocacy. This organization operates within the framework of the US Government, influencing policies and practices that affect the working conditions and benefits of Federal Workers. Additionally, the American Federation of Government Employees has a strong relation to Paychecks, as it actively engages in matters concerning the remuneration and financial welfare of those under its representation.","[[""American_Federation_of_Government_Employees"", ""impacts"", ""Federal_Workers""], [""American_Federation_of_Government_Employees"", ""operates_within"", ""US_Government""], [""American_Federation_of_Government_Employees"", ""influences"", ""policies""], [""American_Federation_of_Government_Employees"", ""influences"", ""practices""], [""policies"", ""affect"", ""working_conditions""], [""practices"", ""affect"", ""working_conditions""], [""policies"", ""affect"", ""benefits""], [""practices"", ""affect"", ""benefits""], [""American_Federation_of_Government_Employees"", ""related_to"", ""Paychecks""], [""American_Federation_of_Government_Employees"", ""engages_in"", ""remuneration""], [""American_Federation_of_Government_Employees"", ""engages_in"", ""financial_welfare""], [""American_Federation_of_Government_Employees"", ""represents"", ""Federal_Workers""]]","The American Federation of Government Employees has a significant impact on federal workers, influencing various aspects of their professional lives and working conditions.","[[""American_Federation_of_Government_Employees"", ""impacts"", ""federal_workers""], [""American_Federation_of_Government_Employees"", ""influences"", ""professional_lives""], [""American_Federation_of_Government_Employees"", ""influences"", ""working_conditions""]]"
11,"Jeff Van Drew has a notable impact on Pelosi and the broader group of House Democrats, influencing political dynamics within the legislative process. Pelosi, a key figure in the U.S. Congress, has operational influence there, directing significant actions such as controlling the response to a government shutdown. Her political maneuvers and decisions often relate to Donald Trump, reflecting the interconnected nature of their political spheres.","[[""Jeff_Van_Drew"", ""has_impact_on"", ""Pelosi""], [""Jeff_Van_Drew"", ""has_impact_on"", ""House_Democrats""], [""Pelosi"", ""key_figure_in"", ""U.S._Congress""], [""Pelosi"", ""has_operational_influence_in"", ""U.S._Congress""], [""Pelosi"", ""directs"", ""significant_actions""], [""significant_actions"", ""include"", ""controlling_response_to_government_shutdown""], [""Pelosi"", ""related_to"", ""Donald_Trump""], [""political_manuevers"", ""made_by"", ""Pelosi""], [""political_manuevers"", ""relate_to"", ""Donald_Trump""], [""Pelosi"", ""makes"", ""political_decisions""], [""political_decisions"", ""relate_to"", ""Donald_Trump""]]","Jeff Van Drew has a significant impact on both Pelosi and House Democrats. Pelosi, who operates in the U.S. Congress, plays a notable role in the political landscape and has a relationship with Donald Trump. Additionally, Pelosi has the authority to control events such as government shutdowns.","[[""Jeff_Van_Drew"", ""has_impact_on"", ""Pelosi""], [""Jeff_Van_Drew"", ""has_impact_on"", ""House_Democrats""], [""Pelosi"", ""operates_in"", ""U.S._Congress""], [""Pelosi"", ""plays_notable_role_in"", ""political_landscape""], [""Pelosi"", ""has_relationship_with"", ""Donald_Trump""], [""Pelosi"", ""has_authority_to_control"", ""events""], [""events"", ""include"", ""government_shutdowns""]]"
12,"Europe plays a significant role in impacting Apple Inc., showing its economic influence on major corporations. As a participant in the dynamics of global inflation, Europe contributes to international economic conditions. Additionally, there is a connection between Europe and New Zealand, suggesting intertwined geopolitical or economic interests. The European Council operates within Europe and controls the European Union, guiding policies and decisions that affect the region. The European Council is also related to Jens Weidmann, indicating potential collaboration or influence in financial leadership within Europe.","[[""Europe"", ""impacts"", ""Apple_Inc.""], [""Europe"", ""contributes_to"", ""international_economic_conditions""], [""Europe"", ""connected_to"", ""New_Zealand""], [""European_Council"", ""operates_in"", ""Europe""], [""European_Council"", ""controls"", ""European_Union""], [""European_Council"", ""guides"", ""policies_and_decisions_in_Europe""], [""European_Council"", ""related_to"", ""Jens_Weidmann""], [""Jens_Weidmann"", ""potential_collaboration_with"", ""European_Council""], [""Europe"", ""influences"", ""global_inflation""]]","Europe has a substantial impact on Apple Inc., influencing its business operations and strategic decisions within the continent. Additionally, Europe actively participates in the analysis and implications of U.S. Employment Data, which is vital to global economic assessments. There is an intricate relationship between Europe and New Zealand, highlighting trade and political connections across the global landscape. The European Council operates within Europe, playing a crucial role in the administrative and political functions of the region. It connects closely with investors, emphasizing its influence on investment decisions and economic policies. Moreover, the European Council controls the European Union, directing policy measures and regulatory frameworks that affect member countries.","[[""Europe"", ""impacts"", ""Apple_Inc.""], [""Europe"", ""influences"", ""business_operations_of_Apple_Inc.""], [""Europe"", ""participates_in"", ""analysis_of_U.S._Employment_Data""], [""Europe"", ""connected_to"", ""New_Zealand""], [""European_Council"", ""operates_in"", ""Europe""], [""European_Council"", ""controls"", ""European_Union""], [""European_Council"", ""directs"", ""policy_measures_in_European_Union""], [""European_Council"", ""influences"", ""investment_decisions""], [""European_Council"", ""connects_with"", ""investors""], [""U.S._Employment_Data"", ""vital_to"", ""global_economic_assessments""], [""Europe"", ""affects"", ""regulatory_frameworks_in_European_Union""]]"
13,"Sam Brownback is related to the US Government and has connections with topics concerning religious freedom. Additionally, his associations extend to the Saudi Government, highlighting his involvement in matters that bridge these entities and subjects.","[[""Sam_Brownback"", ""related_to"", ""US_Government""], [""Sam_Brownback"", ""connected_to"", ""topics_concerning_religious_freedom""], [""Sam_Brownback"", ""associated_with"", ""Saudi_Government""], [""US_Government"", ""related_to"", ""Sam_Brownback""], [""Saudi_Government"", ""associated_with"", ""Sam_Brownback""], [""topics_concerning_religious_freedom"", ""connected_to"", ""Sam_Brownback""]]","Sam Brownback has a connection with the US Government, and his work is also related to the advocacy and promotion of religious freedom.","[[""Sam_Brownback"", ""connected_to"", ""US_Government""], [""Sam_Brownback"", ""work_related_to"", ""advocacy_of_religious_freedom""], [""Sam_Brownback"", ""work_related_to"", ""promotion_of_religious_freedom""], [""US_Government"", ""connected_to"", ""Sam_Brownback""], [""advocacy_of_religious_freedom"", ""work_of"", ""Sam_Brownback""], [""promotion_of_religious_freedom"", ""work_of"", ""Sam_Brownback""]]"
14,"Monetary policy has a significant impact on both unemployment and U.S. stocks, and it is intricately related to the broader economic conditions. The financial sector also plays a crucial role in shaping the dynamics of the stock market. Mark Carney's expertise is closely associated with both inflation and the implementation of monetary policies, and he plays a pivotal role in controlling the financial sector. Inflation, in turn, exerts a negative impact on bond yield while also affecting producer prices.","[[""Monetary_policy"", ""impact_on"", ""unemployment""], [""Monetary_policy"", ""impact_on"", ""U.S._stocks""], [""Monetary_policy"", ""related_to"", ""broader_economic_conditions""], [""Financial_sector"", ""role_in"", ""stock_market""], [""Mark_Carney"", ""expertise_in"", ""inflation""], [""Mark_Carney"", ""expertise_in"", ""monetary_policies""], [""Mark_Carney"", ""role_in"", ""financial_sector""], [""Inflation"", ""impact_on"", ""bond_yield""], [""Inflation"", ""impact_on"", ""producer_prices""]]","Monetary policy plays a significant role in influencing unemployment and U.S. stocks, as well as having a broader relationship with general economic conditions. Mark Carney exerts control over the financial sector, which in turn impacts the stock market. In the realm of inflation, it has a negative impact on bond yield, while also affecting producer prices.","[[""Monetary_policy"", ""role_in"", ""unemployment""], [""Monetary_policy"", ""role_in"", ""U.S._stocks""], [""Monetary_policy"", ""related_to"", ""general_economic_conditions""], [""Mark_Carney"", ""control_over"", ""financial_sector""], [""Financial_sector"", ""impact_on"", ""stock_market""], [""Inflation"", ""impact_on"", ""bond_yield""], [""Inflation"", ""impact_on"", ""producer_prices""]]"
